CREATE EXTENSION orioledb;
CREATE TABLE o_ddl_check
(
	f1 text,
	f2 varchar,
	f3 integer,
	PRIMARY KEY(f1)
) USING orioledb;
SELECT * FROM o_ddl_check;
 f1 | f2 | f3 
----+----+----
(0 rows)

INSERT INTO o_ddl_check VALUES ('1', NULL, NULL);
-- Fails because of NULL values
ALTER TABLE o_ddl_check ALTER f2 SET NOT NULL;
ERROR:  column "f2" of relation "o_ddl_check" contains null values
TRUNCATE o_ddl_check;
INSERT INTO o_ddl_check VALUES ('1', '2', NULL);
-- OK
ALTER TABLE o_ddl_check ALTER f2 SET NOT NULL;
DROP TABLE o_ddl_check;
CREATE TABLE o_ddl_check
(
	f1 text NOT NULL COLLATE "C",
	f2 varchar NOT NULL,
	f3 integer,
	PRIMARY KEY (f1)
) USING orioledb;
INSERT INTO o_ddl_check VALUES ('1', '2', NULL);
-- Fails, because of NOT NULL constraint
INSERT INTO o_ddl_check VALUES ('2', NULL, '3');
ERROR:  null value in column "f2" of relation "o_ddl_check" violates not-null constraint
DETAIL:  Failing row contains (2, null, 3).
-- Fails, because of unique constraint
INSERT INTO o_ddl_check VALUES ('1', '2', '3');
ERROR:  duplicate key value violates unique constraint "o_ddl_check"
DETAIL:  Key ('1') already exists
SELECT * FROM o_ddl_check;
 f1 | f2 | f3 
----+----+----
 1  | 2  |   
(1 row)

SELECT orioledb_table_description('o_ddl_check'::regclass);
                  orioledb_table_description                  
--------------------------------------------------------------
 Compress = -1, Primary compress = -1, TOAST compress = -1   +
  Column |              Type | Collation | Nullable | Droped +
      f1 |              text |         C |    false |  false +
      f2 | character varying |   default |    false |  false +
      f3 |           integer |    (null) |     true |  false +
 
(1 row)

-- Fails because can't drop NOT NULL contraint on PK
ALTER TABLE o_ddl_check ALTER f1 DROP NOT NULL;
ERROR:  column "f1" is in a primary key
SELECT orioledb_table_description('o_ddl_check'::regclass);
                  orioledb_table_description                  
--------------------------------------------------------------
 Compress = -1, Primary compress = -1, TOAST compress = -1   +
  Column |              Type | Collation | Nullable | Droped +
      f1 |              text |         C |    false |  false +
      f2 | character varying |   default |    false |  false +
      f3 |           integer |    (null) |     true |  false +
 
(1 row)

SELECT * FROM o_ddl_check;
 f1 | f2 | f3 
----+----+----
 1  | 2  |   
(1 row)

-- Fails on unknown option
ALTER TABLE o_ddl_check OPTIONS (SET hello 'world');
ERROR:  ALTER action OPTIONS cannot be performed on relation "o_ddl_check"
DETAIL:  This operation is not supported for tables.
ALTER TABLE o_ddl_check ALTER f2 TYPE text;
SELECT orioledb_table_description('o_ddl_check'::regclass);
                orioledb_table_description                 
-----------------------------------------------------------
 Compress = -1, Primary compress = -1, TOAST compress = -1+
  Column |    Type | Collation | Nullable | Droped        +
      f1 |    text |         C |    false |  false        +
      f2 |    text |   default |    false |  false        +
      f3 | integer |    (null) |     true |  false        +
 
(1 row)

-- OK, because 'f2' isn't indexed
ALTER TABLE o_ddl_check ALTER f2 TYPE varchar COLLATE "POSIX";
SELECT orioledb_table_description('o_ddl_check'::regclass);
                  orioledb_table_description                  
--------------------------------------------------------------
 Compress = -1, Primary compress = -1, TOAST compress = -1   +
  Column |              Type | Collation | Nullable | Droped +
      f1 |              text |         C |    false |  false +
      f2 | character varying |     POSIX |    false |  false +
      f3 |           integer |    (null) |     true |  false +
 
(1 row)

-- Fails, because 'f2' is indexed with different collation
ALTER TABLE o_ddl_check ALTER f1 TYPE text;
ERROR:  could not change the column collation
DETAIL:  Column "f1" of OrioleDB table "o_ddl_check" id used in "o_ddl_check_pkey" index definition.
ALTER TABLE o_ddl_check ALTER f1 TYPE varchar COLLATE "POSIX";
ERROR:  could not change the column collation
DETAIL:  Column "f1" of OrioleDB table "o_ddl_check" id used in "o_ddl_check_pkey" index definition.
-- OK, because binary compatible and collations match
ALTER TABLE o_ddl_check ALTER f1 TYPE text COLLATE "C";
SELECT orioledb_table_description('o_ddl_check'::regclass);
                  orioledb_table_description                  
--------------------------------------------------------------
 Compress = -1, Primary compress = -1, TOAST compress = -1   +
  Column |              Type | Collation | Nullable | Droped +
      f1 |              text |         C |    false |  false +
      f2 | character varying |     POSIX |    false |  false +
      f3 |           integer |    (null) |     true |  false +
 
(1 row)

SELECT * FROM o_ddl_check;
 f1 | f2 | f3 
----+----+----
 1  | 2  |   
(1 row)

-- Fails, because types aren't binary compatible
ALTER TABLE o_ddl_check ALTER f2 TYPE timestamp;
ERROR:  could not change the column type
DETAIL:  Column "f2" of OrioleDB table "o_ddl_check" has type "character varying". Can't change to "pg_catalog.timestamp", because it's not binary coersible.
ALTER TABLE o_ddl_check ALTER f2 DROP NOT NULL;
ALTER TABLE o_ddl_check ALTER f2 SET NOT NULL;
SELECT orioledb_table_description('o_ddl_check'::regclass);
                  orioledb_table_description                  
--------------------------------------------------------------
 Compress = -1, Primary compress = -1, TOAST compress = -1   +
  Column |              Type | Collation | Nullable | Droped +
      f1 |              text |         C |    false |  false +
      f2 | character varying |     POSIX |    false |  false +
      f3 |           integer |    (null) |     true |  false +
 
(1 row)

ALTER TABLE o_ddl_check DROP f2;
ALTER TABLE o_ddl_check DROP f1;
ERROR:  could not drop the column
DETAIL:  Column "f1" of OrioleDB table "o_ddl_check" id used in "o_ddl_check_pkey" index definition.
SELECT orioledb_table_description('o_ddl_check'::regclass);
                  orioledb_table_description                  
--------------------------------------------------------------
 Compress = -1, Primary compress = -1, TOAST compress = -1   +
  Column |              Type | Collation | Nullable | Droped +
      f1 |              text |         C |    false |  false +
      f2 | character varying |     POSIX |    false |   true +
      f3 |           integer |    (null) |     true |  false +
 
(1 row)

SELECT * FROM o_ddl_check;
 f1 | f3 
----+----
 1  |   
(1 row)

DROP TABLE o_ddl_check;
CREATE TABLE o_ddl_check
(
	f1 varchar COLLATE "C",
	f2 text NOT NULL,
	PRIMARY KEY(f1)
) USING orioledb;
INSERT INTO o_ddl_check VALUES ('a', NULL);
ERROR:  null value in column "f2" of relation "o_ddl_check" violates not-null constraint
DETAIL:  Failing row contains (a, null).
INSERT INTO o_ddl_check VALUES (NULL, 'b');
ERROR:  null value in column "f1" of relation "o_ddl_check" violates not-null constraint
DETAIL:  Failing row contains (null, b).
INSERT INTO o_ddl_check VALUES ('a', 'b');
UPDATE o_ddl_check SET f1 = NULL WHERE f1 = 'a';
ERROR:  null value in column "f1" of relation "o_ddl_check" violates not-null constraint
DETAIL:  Failing row contains (null, b).
SELECT * FROM o_ddl_check;
 f1 | f2 
----+----
 a  | b
(1 row)

ALTER TABLE o_ddl_check ADD CHECK (f2 < 'f');
INSERT INTO o_ddl_check VALUES ('b', 'ddd');
INSERT INTO o_ddl_check VALUES ('c', 'ffff');
ERROR:  new row for relation "o_ddl_check" violates check constraint "o_ddl_check_f2_check"
DETAIL:  Failing row contains (c, ffff).
CREATE UNIQUE INDEX o_ddl_check_f2_idx ON o_ddl_check(f2);
ALTER TABLE o_ddl_check ALTER f2 DROP NOT NULL;
ALTER TABLE o_ddl_check ALTER f2 SET NOT NULL;
-- Check partition consraint.
CREATE TABLE o_ddl_parted
(
	f1 varchar COLLATE "C",
	f2 text NOT NULL
) PARTITION BY RANGE (f1);
ALTER TABLE o_ddl_parted ATTACH PARTITION o_ddl_check FOR VALUES FROM ('a') TO ('d');
SELECT * FROM o_ddl_parted;
 f1 | f2  
----+-----
 a  | b
 b  | ddd
(2 rows)

INSERT INTO o_ddl_parted VALUES ('abc', 'def');
-- OK
UPDATE o_ddl_parted SET f1 = 'bcd' WHERE f1 = 'abc';
-- Partition constraint failure
UPDATE o_ddl_parted SET f1 = 'efg' WHERE f1 = 'bcd';
ERROR:  no partition of relation "o_ddl_parted" found for row
DETAIL:  Partition key of the failing row contains (f1) = (efg).
SELECT * FROM o_ddl_parted;
 f1  | f2  
-----+-----
 a   | b
 b   | ddd
 bcd | def
(3 rows)

CREATE TABLE o_ddl_check_2
(
	f1 varchar COLLATE "C",
	f2 text NOT NULL,
	PRIMARY KEY(f1)
) USING orioledb;
ALTER TABLE o_ddl_parted ATTACH PARTITION o_ddl_check_2 FOR VALUES FROM ('e') TO ('h');
-- Move row between partitions
UPDATE o_ddl_parted SET f1 = 'efg' WHERE f1 = 'bcd';
SELECT * FROM o_ddl_parted;
 f1  | f2  
-----+-----
 a   | b
 b   | ddd
 efg | def
(3 rows)

ALTER TABLE o_ddl_parted DETACH PARTITION o_ddl_check;
ALTER TABLE o_ddl_parted DETACH PARTITION o_ddl_check_2;
DROP TABLE o_ddl_parted;
DROP TABLE o_ddl_check;
DROP TABLE o_ddl_check_2;
CREATE TABLE o_ddl_check
(
	f1 int NOT NULL,
	f2 int,
	f3 int,
	f4 int,
	PRIMARY KEY(f1)
) USING orioledb;
CREATE UNIQUE INDEX o_ddl_check_unique ON o_test24 (f2, f3, f4);
ERROR:  relation "o_test24" does not exist
CREATE INDEX o_ddl_check_regular ON o_test24 (f2, f3, f4);
ERROR:  relation "o_test24" does not exist
INSERT INTO o_ddl_check VALUES (1, 2, NULL, 5);
INSERT INTO o_ddl_check VALUES (2, 2, NULL, 3);
INSERT INTO o_ddl_check VALUES (3, 2, NULL, 2);
INSERT INTO o_ddl_check VALUES (4, 1, NULL, 4);
INSERT INTO o_ddl_check VALUES (5, 2, NULL, 3);
INSERT INTO o_ddl_check VALUES (6, 2, NULL, NULL);
INSERT INTO o_ddl_check VALUES (7, 2, NULL, NULL);
SELECT * FROM o_ddl_check;
 f1 | f2 | f3 | f4 
----+----+----+----
  1 |  2 |    |  5
  2 |  2 |    |  3
  3 |  2 |    |  2
  4 |  1 |    |  4
  5 |  2 |    |  3
  6 |  2 |    |   
  7 |  2 |    |   
(7 rows)

SELECT orioledb_tbl_structure('o_ddl_check'::regclass, 'nuebc');
                       orioledb_tbl_structure                        
---------------------------------------------------------------------
 Index o_ddl_check_pkey contents                                    +
 Page 0: level = 0, maxKeyLen = 8, csn = FROZEN, nVacatedBytes = 0  +
 state = free, datoid equal, relnode equal, ix_type = primary, dirty+
     Leftmost, Rightmost                                            +
   Chunk 0: offset = 0, location = 256, hikey location = 64         +
     Item 0: csn = 0, offset = 272, tuple = ('1', '2', null, '5')   +
     Item 1: csn = 1, offset = 320, tuple = ('2', '2', null, '3')   +
     Item 2: csn = 2, offset = 368, tuple = ('3', '2', null, '2')   +
     Item 3: csn = 3, offset = 416, tuple = ('4', '1', null, '4')   +
     Item 4: csn = 4, offset = 464, tuple = ('5', '2', null, '3')   +
     Item 5: csn = 5, offset = 512, tuple = ('6', '2', null, null)  +
     Item 6: csn = 6, offset = 552, tuple = ('7', '2', null, null)  +
                                                                    +
 Index toast: not loaded                                            +
 
(1 row)

DROP TABLE o_ddl_check;
CREATE TABLE o_ddl_missing (
	i int4 NOT NULL
) USING orioledb;
INSERT INTO o_ddl_missing SELECT * FROM generate_series(1, 10);
ALTER TABLE o_ddl_missing ADD COLUMN l int4;
SELECT * FROM o_ddl_missing;
 i  | l 
----+---
  1 |  
  2 |  
  3 |  
  4 |  
  5 |  
  6 |  
  7 |  
  8 |  
  9 |  
 10 |  
(10 rows)

ALTER TABLE o_ddl_missing ADD COLUMN m int4 DEFAULT 2;
SELECT * FROM o_ddl_missing;
 i  | l | m 
----+---+---
  1 |   | 2
  2 |   | 2
  3 |   | 2
  4 |   | 2
  5 |   | 2
  6 |   | 2
  7 |   | 2
  8 |   | 2
  9 |   | 2
 10 |   | 2
(10 rows)

ALTER TABLE o_ddl_missing ADD COLUMN n int4, ADD COLUMN o int4[];
SELECT * FROM o_ddl_missing;
 i  | l | m | n | o 
----+---+---+---+---
  1 |   | 2 |   | 
  2 |   | 2 |   | 
  3 |   | 2 |   | 
  4 |   | 2 |   | 
  5 |   | 2 |   | 
  6 |   | 2 |   | 
  7 |   | 2 |   | 
  8 |   | 2 |   | 
  9 |   | 2 |   | 
 10 |   | 2 |   | 
(10 rows)

UPDATE o_ddl_missing SET l = 5, n = 6, o = '{1, 5, 2}' WHERE i BETWEEN 3 AND 7;
SELECT * FROM o_ddl_missing;
 i  | l | m | n |    o    
----+---+---+---+---------
  1 |   | 2 |   | 
  2 |   | 2 |   | 
  3 | 5 | 2 | 6 | {1,5,2}
  4 | 5 | 2 | 6 | {1,5,2}
  5 | 5 | 2 | 6 | {1,5,2}
  6 | 5 | 2 | 6 | {1,5,2}
  7 | 5 | 2 | 6 | {1,5,2}
  8 |   | 2 |   | 
  9 |   | 2 |   | 
 10 |   | 2 |   | 
(10 rows)

ALTER TABLE o_ddl_missing
	DROP COLUMN m,
	ADD COLUMN p int4[] DEFAULT '{2, 4, 8}',
	ADD COLUMN r int4[];
SELECT * FROM o_ddl_missing;
 i  | l | n |    o    |    p    | r 
----+---+---+---------+---------+---
  1 |   |   |         | {2,4,8} | 
  2 |   |   |         | {2,4,8} | 
  3 | 5 | 6 | {1,5,2} | {2,4,8} | 
  4 | 5 | 6 | {1,5,2} | {2,4,8} | 
  5 | 5 | 6 | {1,5,2} | {2,4,8} | 
  6 | 5 | 6 | {1,5,2} | {2,4,8} | 
  7 | 5 | 6 | {1,5,2} | {2,4,8} | 
  8 |   |   |         | {2,4,8} | 
  9 |   |   |         | {2,4,8} | 
 10 |   |   |         | {2,4,8} | 
(10 rows)

CREATE FUNCTION pseudo_random(seed bigint, i bigint) RETURNS float8 AS
$$
	SELECT substr(sha256(($1::text || ' ' || $2::text)::bytea)::text,2,16)::bit(52)::bigint::float8 / pow(2.0, 52.0);
$$ LANGUAGE sql;
CREATE TABLE o_test_add_column
(
	id serial primary key,
	i int4
) USING orioledb;
\d o_test_add_column
                            Table "public.o_test_add_column"
 Column |  Type   | Collation | Nullable |                    Default                    
--------+---------+-----------+----------+-----------------------------------------------
 id     | integer |           | not null | nextval('o_test_add_column_id_seq'::regclass)
 i      | integer |           |          | 
Indexes:
    "o_test_add_column_pkey" PRIMARY KEY, btree (id)

SELECT orioledb_tbl_indices('o_test_add_column'::regclass);
              orioledb_tbl_indices              
------------------------------------------------
 Index o_test_add_column_pkey                  +
     Index type: primary, unique               +
     Leaf tuple size: 2, non-leaf tuple size: 1+
     Non-leaf tuple fields: id                 +
 
(1 row)

SELECT orioledb_tbl_structure('o_test_add_column'::regclass, 'ne');
          orioledb_tbl_structure          
------------------------------------------
 Index o_test_add_column_pkey: not loaded+
 Index toast: not loaded                 +
 
(1 row)

INSERT INTO o_test_add_column (i)
	SELECT pseudo_random(1, v) * 20000 FROM generate_series(1,10) v;
-- test new null column
ALTER TABLE o_test_add_column ADD COLUMN y int4;
\d o_test_add_column
                            Table "public.o_test_add_column"
 Column |  Type   | Collation | Nullable |                    Default                    
--------+---------+-----------+----------+-----------------------------------------------
 id     | integer |           | not null | nextval('o_test_add_column_id_seq'::regclass)
 i      | integer |           |          | 
 y      | integer |           |          | 
Indexes:
    "o_test_add_column_pkey" PRIMARY KEY, btree (id)

SELECT orioledb_tbl_indices('o_test_add_column'::regclass);
              orioledb_tbl_indices              
------------------------------------------------
 Index o_test_add_column_pkey                  +
     Index type: primary, unique               +
     Leaf tuple size: 3, non-leaf tuple size: 1+
     Non-leaf tuple fields: id                 +
 
(1 row)

SELECT orioledb_tbl_structure('o_test_add_column'::regclass, 'ne');
                       orioledb_tbl_structure                        
---------------------------------------------------------------------
 Index o_test_add_column_pkey contents                              +
 Page 0: level = 0, maxKeyLen = 8, nVacatedBytes = 0                +
 state = free, datoid equal, relnode equal, ix_type = primary, dirty+
     Leftmost, Rightmost                                            +
   Chunk 0: offset = 0, location = 256, hikey location = 64         +
     Item 0: offset = 280, tuple = ('1', '159', null)               +
     Item 1: offset = 304, tuple = ('2', '19305', null)             +
     Item 2: offset = 328, tuple = ('3', '7790', null)              +
     Item 3: offset = 352, tuple = ('4', '16764', null)             +
     Item 4: offset = 376, tuple = ('5', '8182', null)              +
     Item 5: offset = 400, tuple = ('6', '3414', null)              +
     Item 6: offset = 424, tuple = ('7', '16703', null)             +
     Item 7: offset = 448, tuple = ('8', '18766', null)             +
     Item 8: offset = 472, tuple = ('9', '18518', null)             +
     Item 9: offset = 496, tuple = ('10', '18915', null)            +
                                                                    +
 Index toast: not loaded                                            +
 
(1 row)

-- test new column with volatile default
ALTER TABLE o_test_add_column ADD COLUMN z int4 default 5;
\d o_test_add_column
                            Table "public.o_test_add_column"
 Column |  Type   | Collation | Nullable |                    Default                    
--------+---------+-----------+----------+-----------------------------------------------
 id     | integer |           | not null | nextval('o_test_add_column_id_seq'::regclass)
 i      | integer |           |          | 
 y      | integer |           |          | 
 z      | integer |           |          | 5
Indexes:
    "o_test_add_column_pkey" PRIMARY KEY, btree (id)

SELECT orioledb_tbl_indices('o_test_add_column'::regclass);
              orioledb_tbl_indices              
------------------------------------------------
 Index o_test_add_column_pkey                  +
     Index type: primary, unique               +
     Leaf tuple size: 4, non-leaf tuple size: 1+
     Non-leaf tuple fields: id                 +
 
(1 row)

SELECT orioledb_tbl_structure('o_test_add_column'::regclass, 'ne');
                       orioledb_tbl_structure                        
---------------------------------------------------------------------
 Index o_test_add_column_pkey contents                              +
 Page 0: level = 0, maxKeyLen = 8, nVacatedBytes = 0                +
 state = free, datoid equal, relnode equal, ix_type = primary, dirty+
     Leftmost, Rightmost                                            +
   Chunk 0: offset = 0, location = 256, hikey location = 64         +
     Item 0: offset = 280, tuple = ('1', '159', null, null)         +
     Item 1: offset = 304, tuple = ('2', '19305', null, null)       +
     Item 2: offset = 328, tuple = ('3', '7790', null, null)        +
     Item 3: offset = 352, tuple = ('4', '16764', null, null)       +
     Item 4: offset = 376, tuple = ('5', '8182', null, null)        +
     Item 5: offset = 400, tuple = ('6', '3414', null, null)        +
     Item 6: offset = 424, tuple = ('7', '16703', null, null)       +
     Item 7: offset = 448, tuple = ('8', '18766', null, null)       +
     Item 8: offset = 472, tuple = ('9', '18518', null, null)       +
     Item 9: offset = 496, tuple = ('10', '18915', null, null)      +
                                                                    +
 Index toast: not loaded                                            +
 
(1 row)

CREATE SEQUENCE o_test_j_seq;
-- test new column with non-volatile default
ALTER TABLE o_test_add_column
	ADD COLUMN j int4 not null default pseudo_random(2, nextval('o_test_j_seq')) * 20000;
\d o_test_add_column
                                                 Table "public.o_test_add_column"
 Column |  Type   | Collation | Nullable |                                         Default                                         
--------+---------+-----------+----------+-----------------------------------------------------------------------------------------
 id     | integer |           | not null | nextval('o_test_add_column_id_seq'::regclass)
 i      | integer |           |          | 
 y      | integer |           |          | 
 z      | integer |           |          | 5
 j      | integer |           | not null | (pseudo_random(2::bigint, nextval('o_test_j_seq'::regclass)) * 20000::double precision)
Indexes:
    "o_test_add_column_pkey" PRIMARY KEY, btree (id)

SELECT orioledb_tbl_indices('o_test_add_column'::regclass);
              orioledb_tbl_indices              
------------------------------------------------
 Index o_test_add_column_pkey                  +
     Index type: primary, unique               +
     Leaf tuple size: 5, non-leaf tuple size: 1+
     Non-leaf tuple fields: id                 +
 
(1 row)

SELECT orioledb_tbl_structure('o_test_add_column'::regclass, 'ne');
          orioledb_tbl_structure          
------------------------------------------
 Index o_test_add_column_pkey: not loaded+
 Index toast: not loaded                 +
 
(1 row)

INSERT INTO o_test_add_column (i)
	SELECT pseudo_random(3, v) * 20000 FROM generate_series(1,5) v;
SELECT orioledb_tbl_structure('o_test_add_column'::regclass, 'ne');
                           orioledb_tbl_structure                            
-----------------------------------------------------------------------------
 Index o_test_add_column_pkey contents                                      +
 Page 0: level = 0, maxKeyLen = 8, nVacatedBytes = 0                        +
 state = free, datoid equal, relnode equal, ix_type = primary, dirty        +
     Leftmost, Rightmost                                                    +
   Chunk 0: offset = 0, location = 256, hikey location = 96, hikey = ('2')  +
     Item 0: offset = 264, tuple = ('1', '159', null, '5', '17928')         +
   Chunk 1: offset = 1, location = 312, hikey location = 104, hikey = ('3') +
     Item 1: offset = 320, tuple = ('2', '19305', null, '5', '332')         +
   Chunk 2: offset = 2, location = 368, hikey location = 112, hikey = ('4') +
     Item 2: offset = 376, tuple = ('3', '7790', null, '5', '9675')         +
   Chunk 3: offset = 3, location = 424, hikey location = 120, hikey = ('5') +
     Item 3: offset = 432, tuple = ('4', '16764', null, '5', '17247')       +
   Chunk 4: offset = 4, location = 480, hikey location = 128, hikey = ('6') +
     Item 4: offset = 488, tuple = ('5', '8182', null, '5', '5534')         +
   Chunk 5: offset = 5, location = 536, hikey location = 136, hikey = ('7') +
     Item 5: offset = 544, tuple = ('6', '3414', null, '5', '515')          +
   Chunk 6: offset = 6, location = 592, hikey location = 144, hikey = ('8') +
     Item 6: offset = 600, tuple = ('7', '16703', null, '5', '9615')        +
   Chunk 7: offset = 7, location = 648, hikey location = 152, hikey = ('9') +
     Item 7: offset = 656, tuple = ('8', '18766', null, '5', '12229')       +
   Chunk 8: offset = 8, location = 704, hikey location = 160, hikey = ('10')+
     Item 8: offset = 712, tuple = ('9', '18518', null, '5', '16597')       +
   Chunk 9: offset = 9, location = 760, hikey location = 168                +
     Item 9: offset = 776, tuple = ('10', '18915', null, '5', '9993')       +
     Item 10: offset = 824, tuple = ('11', '3206', null, '5', '5149')       +
     Item 11: offset = 872, tuple = ('12', '15492', null, '5', '9798')      +
     Item 12: offset = 920, tuple = ('13', '16020', null, '5', '17916')     +
     Item 13: offset = 968, tuple = ('14', '9948', null, '5', '19971')      +
     Item 14: offset = 1016, tuple = ('15', '4451', null, '5', '1747')      +
                                                                            +
 Index toast: not loaded                                                    +
 
(1 row)

EXPLAIN (COSTS OFF) SELECT * FROM o_test_add_column;
          QUERY PLAN           
-------------------------------
 Seq Scan on o_test_add_column
(1 row)

SELECT * FROM o_test_add_column;
 id |   i   | y | z |   j   
----+-------+---+---+-------
  1 |   159 |   | 5 | 17928
  2 | 19305 |   | 5 |   332
  3 |  7790 |   | 5 |  9675
  4 | 16764 |   | 5 | 17247
  5 |  8182 |   | 5 |  5534
  6 |  3414 |   | 5 |   515
  7 | 16703 |   | 5 |  9615
  8 | 18766 |   | 5 | 12229
  9 | 18518 |   | 5 | 16597
 10 | 18915 |   | 5 |  9993
 11 |  3206 |   | 5 |  5149
 12 | 15492 |   | 5 |  9798
 13 | 16020 |   | 5 | 17916
 14 |  9948 |   | 5 | 19971
 15 |  4451 |   | 5 |  1747
(15 rows)

-- Test that default fields not recalculated
SELECT * FROM o_test_add_column;
 id |   i   | y | z |   j   
----+-------+---+---+-------
  1 |   159 |   | 5 | 17928
  2 | 19305 |   | 5 |   332
  3 |  7790 |   | 5 |  9675
  4 | 16764 |   | 5 | 17247
  5 |  8182 |   | 5 |  5534
  6 |  3414 |   | 5 |   515
  7 | 16703 |   | 5 |  9615
  8 | 18766 |   | 5 | 12229
  9 | 18518 |   | 5 | 16597
 10 | 18915 |   | 5 |  9993
 11 |  3206 |   | 5 |  5149
 12 | 15492 |   | 5 |  9798
 13 | 16020 |   | 5 | 17916
 14 |  9948 |   | 5 | 19971
 15 |  4451 |   | 5 |  1747
(15 rows)

CREATE TABLE o_test_multiple_analyzes (
    aid integer NOT NULL PRIMARY KEY
) USING orioledb;
-- Wrapper function, which converts result of SQL query to the text
CREATE OR REPLACE FUNCTION query_to_text(sql TEXT) RETURNS SETOF TEXT AS $$
	BEGIN
		RETURN QUERY EXECUTE sql;
	END $$
LANGUAGE plpgsql;
INSERT INTO o_test_multiple_analyzes
	SELECT aid FROM generate_series(1, 10) aid;
BEGIN;
select count(1) from o_test_multiple_analyzes;
 count 
-------
    10
(1 row)

SELECT regexp_replace(t, '[\d\.]+', 'x', 'g')
FROM query_to_text('explain (analyze, buffers)
	select * from o_test_multiple_analyzes ORDER BY aid DESC LIMIT 10;') as t;
                                                 regexp_replace                                                 
----------------------------------------------------------------------------------------------------------------
 Limit  (cost=x rows=x width=x) (actual time=x rows=x loops=x)
   ->  Custom Scan (o_scan) on o_test_multiple_analyzes  (cost=x rows=x width=x) (actual time=x rows=x loops=x)
         Backward index only scan of: o_test_multiple_analyzes_pkey
         Primary pages: read=x
 Planning:
   Buffers: shared hit=x
 Planning Time: x ms
 Execution Time: x ms
(8 rows)

SELECT regexp_replace(t, '[\d\.]+', 'x', 'g')
FROM query_to_text('explain (analyze, buffers)
	select count(1) from o_test_multiple_analyzes;') as t;
                                           regexp_replace                                           
----------------------------------------------------------------------------------------------------
 Aggregate  (cost=x rows=x width=x) (actual time=x rows=x loops=x)
   ->  Seq Scan on o_test_multiple_analyzes  (cost=x rows=x width=x) (actual time=x rows=x loops=x)
 Planning:
   Buffers: shared hit=x
 Planning Time: x ms
 Execution Time: x ms
(6 rows)

ROLLBACK;
CREATE FOREIGN DATA WRAPPER dummy;
CREATE SERVER s0 FOREIGN DATA WRAPPER dummy;
CREATE FOREIGN TABLE ft1 (
	c1 integer OPTIONS ("param 1" 'val1') NOT NULL,
	c2 text OPTIONS (param2 'val2', param3 'val3') CHECK (c2 <> ''),
	c3 date,
	CHECK (c3 BETWEEN '1994-01-01'::date AND '1994-01-31'::date)
) SERVER s0 OPTIONS (delimiter ',', quote '"', "be quoted" 'value');
DROP FOREIGN DATA WRAPPER dummy CASCADE;
NOTICE:  drop cascades to 2 other objects
DETAIL:  drop cascades to server s0
drop cascades to foreign table ft1
CREATE TABLE o_unexisting_column
(
	key int4,
	PRIMARY KEY(key)
) USING orioledb;
ALTER TABLE o_unexisting_column ALTER COLUMN key_2 SET DEFAULT 5;
ERROR:  column "key_2" of relation "o_unexisting_column" does not exist
ALTER TABLE o_unexisting_column ALTER COLUMN key_2 DROP DEFAULT;
ERROR:  column "key_2" of relation "o_unexisting_column" does not exist
ALTER TABLE o_unexisting_column RENAME COLUMN key_2 TO key_3;
ERROR:  column "key_2" does not exist
ALTER TABLE o_unexisting_column DROP COLUMN key_2;
ERROR:  column "key_2" of relation "o_unexisting_column" does not exist
ALTER TABLE o_unexisting_column ALTER COLUMN key_2 SET NOT NULL;
ERROR:  column "key_2" of relation "o_unexisting_column" does not exist
ALTER TABLE o_unexisting_column ALTER COLUMN key_2 DROP NOT NULL;
ERROR:  column "key_2" of relation "o_unexisting_column" does not exist
ALTER TABLE o_unexisting_column ALTER key_2 TYPE int;
ERROR:  column "key_2" of relation "o_unexisting_column" does not exist
ALTER TABLE o_unexisting_column ALTER key_2 TYPE int USING key_2::integer;
ERROR:  column "key_2" does not exist
LINE 1: ...LE o_unexisting_column ALTER key_2 TYPE int USING key_2::int...
                                                             ^
HINT:  Perhaps you meant to reference the column "o_unexisting_column.key".
ALTER TABLE o_unexisting_column ALTER COLUMN key_2
	ADD GENERATED ALWAYS AS IDENTITY;
ERROR:  column "key_2" of relation "o_unexisting_column" does not exist
ALTER TABLE o_unexisting_column ALTER COLUMN key
	ADD GENERATED ALWAYS AS IDENTITY;
ERROR:  unsupported alter table subcommand
DETAIL:  Subcommand "ADD IDENTITY" is not supported on OrioleDB tables.
UPDATE o_unexisting_column SET key_2 = 4 WHERE key = 2;
ERROR:  column "key_2" of relation "o_unexisting_column" does not exist
LINE 1: UPDATE o_unexisting_column SET key_2 = 4 WHERE key = 2;
                                       ^
CREATE TABLE o_test_unique_on_conflict (
	key int
) USING orioledb;
CREATE UNIQUE INDEX ON o_test_unique_on_conflict(key);
INSERT INTO o_test_unique_on_conflict(key)
	(SELECT key FROM generate_series (1, 1) key);
INSERT INTO o_test_unique_on_conflict (key)
	SELECT * FROM generate_series(1, 1)
	ON CONFLICT (key) DO UPDATE
		SET key = o_test_unique_on_conflict.key + 100;
SELECT * FROM o_test_unique_on_conflict;
 key 
-----
 101
(1 row)

CREATE TABLE o_test_update_set_renamed_column(
	val_1 int PRIMARY KEY,
	val_2 int
) USING orioledb;
INSERT INTO o_test_update_set_renamed_column(val_1, val_2)
	(SELECT val_1, val_1 FROM generate_series (1, 1) val_1);
SELECT * FROM o_test_update_set_renamed_column;
 val_1 | val_2 
-------+-------
     1 |     1
(1 row)

ALTER TABLE o_test_update_set_renamed_column RENAME COLUMN val_2 to val_3;
UPDATE o_test_update_set_renamed_column SET val_3 = 5;
SELECT * FROM o_test_update_set_renamed_column;
 val_1 | val_3 
-------+-------
     1 |     5
(1 row)

CREATE TABLE o_test_inherits_1 (
  val_1 int PRIMARY KEY
) USING orioledb;
CREATE TABLE o_test_inherits_2 (
	val_2 int
) INHERITS (o_test_inherits_1) USING orioledb;
BEGIN;
CREATE TABLE o_test(
	id integer NOT NULL,
	val text NOT NULL,
	PRIMARY KEY(id),
	UNIQUE(id, val)
) USING orioledb;
CREATE TABLE o_test_child(
	id integer NOT NULL,
	o_test_ID integer NOT NULL REFERENCES o_test (id),
	PRIMARY KEY(id)
) USING orioledb;
INSERT INTO o_test(id, val) VALUES (1, 'hello');
INSERT INTO o_test(id, val) VALUES (2, 'hey');
DELETE FROM o_test where id = 1;
COMMIT;
DROP FUNCTION pseudo_random CASCADE;
NOTICE:  drop cascades to default value for column j of table o_test_add_column
DROP EXTENSION orioledb CASCADE;
NOTICE:  drop cascades to 10 other objects
DETAIL:  drop cascades to table o_ddl_missing
drop cascades to table o_test_add_column
drop cascades to table o_test_multiple_analyzes
drop cascades to table o_unexisting_column
drop cascades to table o_test_unique_on_conflict
drop cascades to table o_test_update_set_renamed_column
drop cascades to table o_test_inherits_1
drop cascades to table o_test_inherits_2
drop cascades to table o_test
drop cascades to table o_test_child
