CREATE SCHEMA foreign_keys;
SET SESSION search_path = 'foreign_keys';
CREATE EXTENSION orioledb;
CREATE TABLE o_test_text(
       id integer NOT NULL,
       val text NOT NULL,
       PRIMARY KEY(id),
       UNIQUE(val)
) USING orioledb;
CREATE TABLE o_test_text_child(
       id integer NOT NULL,
       o_test_val text NOT NULL REFERENCES o_test_text (val) ON UPDATE CASCADE,
       PRIMARY KEY(id)
) USING orioledb;
CREATE TABLE o_test(
       id integer NOT NULL,
       val text NOT NULL,
       PRIMARY KEY(id),
       UNIQUE(id, val)
) USING orioledb;
CREATE TABLE o_test_child(
       id integer NOT NULL,
       o_test_ID integer NOT NULL REFERENCES o_test (id),
       PRIMARY KEY(id)
) USING orioledb;
CREATE TABLE o_test_child_del(
       id integer NOT NULL,
       o_test_ID  integer NOT NULL REFERENCES o_test (id) ON DELETE CASCADE,
       PRIMARY KEY(id)
) USING orioledb;
CREATE TABLE o_test_child_upd(
       id integer NOT NULL,
       o_test_ID  integer NOT NULL REFERENCES o_test (id) ON UPDATE CASCADE,
       PRIMARY KEY(id)
) USING orioledb;
CREATE TABLE o_test_child_compose(
       id integer NOT NULL,
       o_test_ID integer NOT NULL,
       o_test_val text NOT NULL,
       FOREIGN KEY(o_test_ID, o_test_val) REFERENCES o_test (id, val) ON UPDATE CASCADE ON DELETE CASCADE,
       PRIMARY KEY(id)
) USING orioledb;
-- correct insert
INSERT INTO o_test_text(id, val) VALUES(1, 'text');
INSERT INTO o_test_text_child(id, o_test_val) VALUES(1, 'text');
-- correct update
UPDATE o_test_text SET val='hello' where id = 1;
SELECT * FROM o_test_text;
 id |  val  
----+-------
  1 | hello
(1 row)

SELECT * FROM o_test_text_child;
 id | o_test_val 
----+------------
  1 | hello
(1 row)

-- correct insert
INSERT INTO o_test(id, val) VALUES (1, 'hello');
INSERT INTO o_test(id, val) VALUES (2, 'hey');
INSERT INTO o_test(id, val) VALUES (3, 'hi');
INSERT INTO o_test(id, val) VALUES (4, 'mey');
INSERT INTO o_test(id, val) VALUES (5, 'gogo');
INSERT INTO o_test(id, val) VALUES (6, 'neo');
BEGIN;
INSERT INTO o_test(id, val) VALUES (7, 'cat');
UPDATE o_test SET val = 'dog' WHERE id = 7;
COMMIT;
INSERT INTO o_test_child(id, o_test_ID) VALUES (1, 1);
INSERT INTO o_test_child(id, o_test_ID) VALUES (2, 2);
INSERT INTO o_test_child_upd(id, o_test_ID) VALUES (1, 3);
INSERT INTO o_test_child_del(id, o_test_ID) VALUES (1, 4);
INSERT INTO o_test_child_compose(id, o_test_ID, o_test_val) VALUES (1, 6, 'neo');
INSERT INTO o_test_child_compose(id, o_test_ID, o_test_val) VALUES (2, 7, 'dog');
-- fail insert
INSERT INTO o_test_child(id, o_test_ID) VALUES (3, 10);
ERROR:  insert or update on table "o_test_child" violates foreign key constraint "o_test_child_o_test_id_fkey"
DETAIL:  Key (o_test_id)=(10) is not present in table "o_test".
INSERT INTO o_test_child_compose(id, o_test_ID, o_test_val) VALUES (3, 7, 'xxxxx');
ERROR:  insert or update on table "o_test_child_compose" violates foreign key constraint "o_test_child_compose_o_test_id_o_test_val_fkey"
DETAIL:  Key (o_test_id, o_test_val)=(7, xxxxx) is not present in table "o_test".
INSERT INTO o_test_child_compose(id, o_test_ID, o_test_val) VALUES (4, 10, 'neo');
ERROR:  insert or update on table "o_test_child_compose" violates foreign key constraint "o_test_child_compose_o_test_id_o_test_val_fkey"
DETAIL:  Key (o_test_id, o_test_val)=(10, neo) is not present in table "o_test".
-- fail update
UPDATE o_test SET id = 10 where id = 1;
ERROR:  update or delete on table "o_test" violates foreign key constraint "o_test_child_o_test_id_fkey" on table "o_test_child"
DETAIL:  Key (id)=(1) is still referenced from table "o_test_child".
UPDATE o_test SET id = 10 where id = 4;
ERROR:  update or delete on table "o_test" violates foreign key constraint "o_test_child_del_o_test_id_fkey" on table "o_test_child_del"
DETAIL:  Key (id)=(4) is still referenced from table "o_test_child_del".
UPDATE o_test_child SET o_test_ID = 10 where id = 1;
ERROR:  insert or update on table "o_test_child" violates foreign key constraint "o_test_child_o_test_id_fkey"
DETAIL:  Key (o_test_id)=(10) is not present in table "o_test".
UPDATE o_test_child_del SET o_test_ID = 10 where id = 1;
ERROR:  insert or update on table "o_test_child_del" violates foreign key constraint "o_test_child_del_o_test_id_fkey"
DETAIL:  Key (o_test_id)=(10) is not present in table "o_test".
UPDATE o_test_child_upd SET o_test_ID = 10 where id = 1;
ERROR:  insert or update on table "o_test_child_upd" violates foreign key constraint "o_test_child_upd_o_test_id_fkey"
DETAIL:  Key (o_test_id)=(10) is not present in table "o_test".
UPDATE o_test_child_compose SET o_test_val = 'xxxx' where id = 1;
ERROR:  insert or update on table "o_test_child_compose" violates foreign key constraint "o_test_child_compose_o_test_id_o_test_val_fkey"
DETAIL:  Key (o_test_id, o_test_val)=(6, xxxx) is not present in table "o_test".
UPDATE o_test_child_compose SET o_test_ID = 10 where id = 1;
ERROR:  insert or update on table "o_test_child_compose" violates foreign key constraint "o_test_child_compose_o_test_id_o_test_val_fkey"
DETAIL:  Key (o_test_id, o_test_val)=(10, neo) is not present in table "o_test".
-- fail delete
DELETE FROM o_test where id = 1;
ERROR:  update or delete on table "o_test" violates foreign key constraint "o_test_child_o_test_id_fkey" on table "o_test_child"
DETAIL:  Key (id)=(1) is still referenced from table "o_test_child".
DELETE FROM o_test where id = 3;
ERROR:  update or delete on table "o_test" violates foreign key constraint "o_test_child_upd_o_test_id_fkey" on table "o_test_child_upd"
DETAIL:  Key (id)=(3) is still referenced from table "o_test_child_upd".
-- correct delete
DELETE FROM o_test_child where o_test_ID = 1;
DELETE FROM o_test where id = 1;
DELETE FROM o_test where id = 4;
-- correct update
UPDATE o_test SET val = 'new_dog' where id = 7;
UPDATE o_test SET id = 10 where id = 3;
UPDATE o_test_child SET o_test_ID = 3 where o_test_ID = 1;
UPDATE o_test_child_upd SET o_test_ID = 10 where id = 1;
UPDATE o_test_child_compose SET o_test_val = 'gogo', o_test_ID = 5 where id = 2;
SELECT * FROM o_test;
 id |   val   
----+---------
  2 | hey
  5 | gogo
  6 | neo
  7 | new_dog
 10 | hi
(5 rows)

SELECT * FROM o_test_child;
 id | o_test_id 
----+-----------
  2 |         2
(1 row)

SELECT * FROM o_test_child_upd;
 id | o_test_id 
----+-----------
  1 |        10
(1 row)

SELECT * FROM o_test_child_del;
 id | o_test_id 
----+-----------
(0 rows)

SELECT * FROM o_test_child_compose;
 id | o_test_id | o_test_val 
----+-----------+------------
  1 |         6 | neo
  2 |         5 | gogo
(2 rows)

-- correct delete
DELETE FROM o_test where id = 6 or id = 7;
SELECT * FROM o_test_child_compose;
 id | o_test_id | o_test_val 
----+-----------+------------
  2 |         5 | gogo
(1 row)

DROP EXTENSION orioledb CASCADE;
NOTICE:  drop cascades to 7 other objects
DETAIL:  drop cascades to table o_test_text
drop cascades to table o_test_text_child
drop cascades to table o_test
drop cascades to table o_test_child
drop cascades to table o_test_child_del
drop cascades to table o_test_child_upd
drop cascades to table o_test_child_compose
DROP SCHEMA foreign_keys CASCADE;
RESET search_path;
