CREATE EXTENSION IF NOT EXISTS orioledb;
CREATE TABLE o_test_1 (
	val_1 int,
	val_2 int
) USING orioledb;
INSERT INTO o_test_1 (val_1, val_2)
	(SELECT val_1, val_1 + 100 FROM generate_series (1, 5) val_1);
CREATE OR REPLACE FUNCTION func_trig_o_test_1() RETURNS TRIGGER AS $$
BEGIN
	INSERT INTO o_test_1(val_1) VALUES (OLD.val_1);
	RETURN OLD;
END;
$$ LANGUAGE 'plpgsql';
CREATE TRIGGER trig_o_test_1 AFTER DELETE ON o_test_1 FOR EACH STATEMENT
	EXECUTE PROCEDURE func_trig_o_test_1();
SELECT * FROM o_test_1;
 val_1 | val_2 
-------+-------
     1 |   101
     2 |   102
     3 |   103
     4 |   104
     5 |   105
(5 rows)

DELETE FROM o_test_1 WHERE val_1 = 3;
SELECT * FROM o_test_1;
 val_1 | val_2 
-------+-------
     1 |   101
     2 |   102
     4 |   104
     5 |   105
       |      
(5 rows)

CREATE TABLE o_test_2 (
  val_1 int,
  val_2 int
) USING orioledb;
INSERT INTO o_test_2 (val_1, val_2)
  (SELECT val_1, val_1 + 100 FROM generate_series (1, 5) val_1);
CREATE OR REPLACE FUNCTION func_trig_o_test_2() RETURNS TRIGGER AS $$
BEGIN
	INSERT INTO o_test_2(val_1) VALUES (OLD.val_1);
	RETURN OLD;
END;
$$ LANGUAGE 'plpgsql';
CREATE TRIGGER trig_o_test_2 AFTER UPDATE ON o_test_2 FOR EACH STATEMENT
	EXECUTE PROCEDURE func_trig_o_test_2();
SELECT * FROM o_test_2;
 val_1 | val_2 
-------+-------
     1 |   101
     2 |   102
     3 |   103
     4 |   104
     5 |   105
(5 rows)

UPDATE o_test_2 SET val_1 = val_1 + 100;
SELECT * FROM o_test_2;
 val_1 | val_2 
-------+-------
   101 |   101
   102 |   102
   103 |   103
   104 |   104
   105 |   105
       |      
(6 rows)

CREATE TABLE o_test_3 (
    val_1 int,
    val_2 int
) USING orioledb;
INSERT INTO o_test_3 (val_1, val_2)
    (SELECT val_1, val_1 + 100 FROM generate_series (1, 5) val_1);
CREATE OR REPLACE FUNCTION func_trig_o_test_3() RETURNS TRIGGER AS $$
BEGIN
	UPDATE o_test_3 SET val_1 = val_1 WHERE val_1 = OLD.val_1;
	RETURN OLD;
END;
$$ LANGUAGE 'plpgsql';
CREATE TRIGGER trig_o_test_3 AFTER INSERT ON o_test_3 FOR EACH STATEMENT
	EXECUTE PROCEDURE func_trig_o_test_3();
SELECT * FROM o_test_3;
 val_1 | val_2 
-------+-------
     1 |   101
     2 |   102
     3 |   103
     4 |   104
     5 |   105
(5 rows)

INSERT INTO o_test_3 (val_1, val_2)
    (SELECT val_1, val_1 + 100 FROM generate_series (1, 5) val_1);
SELECT * FROM o_test_3;
 val_1 | val_2 
-------+-------
     1 |   101
     2 |   102
     3 |   103
     4 |   104
     5 |   105
     1 |   101
     2 |   102
     3 |   103
     4 |   104
     5 |   105
(10 rows)

CREATE TABLE o_test_4 (
  val_1 int PRIMARY KEY,
  val_2 text
) USING orioledb;
INSERT INTO o_test_4 (val_1, val_2)
	(SELECT val_1, val_1 + 100 FROM generate_series (1, 5) val_1);
CREATE FUNCTION func_trig_o_test_4() RETURNS TRIGGER AS $$
BEGIN
    RETURN NULL;
END;
$$ LANGUAGE plpgsql;
CREATE TRIGGER trig_1 AFTER UPDATE ON o_test_4
    REFERENCING OLD TABLE AS a NEW TABLE AS i
    FOR EACH STATEMENT EXECUTE FUNCTION func_trig_o_test_4();
SELECT * FROM o_test_4;
 val_1 | val_2 
-------+-------
     1 | 101
     2 | 102
     3 | 103
     4 | 104
     5 | 105
(5 rows)

UPDATE o_test_4 SET val_1 = val_1;
SELECT * FROM o_test_4;
 val_1 | val_2 
-------+-------
     1 | 101
     2 | 102
     3 | 103
     4 | 104
     5 | 105
(5 rows)

DROP FUNCTION func_trig_o_test_1 CASCADE;
NOTICE:  drop cascades to trigger trig_o_test_1 on table o_test_1
DROP FUNCTION func_trig_o_test_2 CASCADE;
NOTICE:  drop cascades to trigger trig_o_test_2 on table o_test_2
DROP FUNCTION func_trig_o_test_3 CASCADE;
NOTICE:  drop cascades to trigger trig_o_test_3 on table o_test_3
DROP FUNCTION func_trig_o_test_4 CASCADE;
NOTICE:  drop cascades to trigger trig_1 on table o_test_4
DROP EXTENSION orioledb CASCADE;
NOTICE:  drop cascades to 4 other objects
DETAIL:  drop cascades to table o_test_1
drop cascades to table o_test_2
drop cascades to table o_test_3
drop cascades to table o_test_4
