Parsed test spec with 2 sessions

starting permutation: s1_setup s2_arm s1_count s2_delete_and_release
step s1_setup: 
	SET orioledb.enable_stopevents = true;
	SET application_name = 's1';

step s2_arm: 
	SELECT pg_stopevent_set('iterator_next',
		'$applicationName == "s1"');

pg_stopevent_set
----------------
                
(1 row)

step s1_count: 
	SELECT count(*) FROM o_bridge_refind;
 <waiting ...>
step s2_delete_and_release: 
	DELETE FROM o_bridge_refind WHERE id BETWEEN 50 AND 80;
	SELECT pg_stopevent_reset('iterator_next');

pg_stopevent_reset
------------------
t                 
(1 row)

step s1_count: <... completed>
count
-----
  469
(1 row)


starting permutation: s2_begin s2_update s1_select s2_commit
step s2_begin: 
	BEGIN;

step s2_update: 
	UPDATE o_bridge_conc SET pos = point(id + 900, id + 900), val = 'updated'
		WHERE id BETWEEN 3 AND 7;

step s1_select: 
	SET enable_seqscan = off;
	SET enable_bitmapscan = off;
	SELECT id, pos, val FROM o_bridge_conc
		WHERE pos <@ box '(0,0),(20,20)' ORDER BY id;

id|pos    |val    
--+-------+-------
 1|(1,1)  |initial
 2|(2,2)  |initial
 3|(3,3)  |initial
 4|(4,4)  |initial
 5|(5,5)  |initial
 6|(6,6)  |initial
 7|(7,7)  |initial
 8|(8,8)  |initial
 9|(9,9)  |initial
10|(10,10)|initial
(10 rows)

step s2_commit: 
	COMMIT;


starting permutation: s2_begin s2_delete s1_select s2_commit
step s2_begin: 
	BEGIN;

step s2_delete: 
	DELETE FROM o_bridge_conc WHERE id BETWEEN 3 AND 7;

step s1_select: 
	SET enable_seqscan = off;
	SET enable_bitmapscan = off;
	SELECT id, pos, val FROM o_bridge_conc
		WHERE pos <@ box '(0,0),(20,20)' ORDER BY id;

id|pos    |val    
--+-------+-------
 1|(1,1)  |initial
 2|(2,2)  |initial
 3|(3,3)  |initial
 4|(4,4)  |initial
 5|(5,5)  |initial
 6|(6,6)  |initial
 7|(7,7)  |initial
 8|(8,8)  |initial
 9|(9,9)  |initial
10|(10,10)|initial
(10 rows)

step s2_commit: 
	COMMIT;


starting permutation: s2_begin s2_insert s1_select s2_commit
step s2_begin: 
	BEGIN;

step s2_insert: 
	INSERT INTO o_bridge_conc
		SELECT i, point(i, i), 'inserted' FROM generate_series(11, 15) i;

step s1_select: 
	SET enable_seqscan = off;
	SET enable_bitmapscan = off;
	SELECT id, pos, val FROM o_bridge_conc
		WHERE pos <@ box '(0,0),(20,20)' ORDER BY id;

id|pos    |val    
--+-------+-------
 1|(1,1)  |initial
 2|(2,2)  |initial
 3|(3,3)  |initial
 4|(4,4)  |initial
 5|(5,5)  |initial
 6|(6,6)  |initial
 7|(7,7)  |initial
 8|(8,8)  |initial
 9|(9,9)  |initial
10|(10,10)|initial
(10 rows)

step s2_commit: 
	COMMIT;

