CREATE SCHEMA index_bridging;
SET SESSION search_path = 'index_bridging';
CREATE EXTENSION orioledb;
CREATE TABLE o_test_ix_ams (
	i int NOT NULL,
	j int4[],
	p point,
	pk1 int,
	pk2 int
-- ) USING heap;
-- ) USING orioledb;
) USING orioledb WITH (index_bridging);
SELECT orioledb_table_description('o_test_ix_ams'::regclass);
                orioledb_table_description                 
-----------------------------------------------------------
 Compress = -1, Primary compress = -1, TOAST compress = -1+
  Column |      Type | Collation | Nullable | Droped      +
       i |   integer |    (null) |    false |  false      +
       j | integer[] |    (null) |     true |  false      +
       p |     point |    (null) |     true |  false      +
     pk1 |   integer |    (null) |     true |  false      +
     pk2 |   integer |    (null) |     true |  false      +
 
(1 row)

\d+ o_test_ix_ams
                            Table "index_bridging.o_test_ix_ams"
 Column |   Type    | Collation | Nullable | Default | Storage  | Stats target | Description 
--------+-----------+-----------+----------+---------+----------+--------------+-------------
 i      | integer   |           | not null |         | plain    |              | 
 j      | integer[] |           |          |         | extended |              | 
 p      | point     |           |          |         | plain    |              | 
 pk1    | integer   |           |          |         | plain    |              | 
 pk2    | integer   |           |          |         | plain    |              | 
Options: index_bridging=true

SELECT orioledb_tbl_indices('o_test_ix_ams'::regclass, true);
                        orioledb_tbl_indices                         
---------------------------------------------------------------------
 Index ctid_primary                                                 +
     Index type: primary, unique, ctid                              +
     Leaf tuple size: 7, non-leaf tuple size: 1                     +
     Non-leaf tuple fields: ctid                                    +
     Leaf tuple fields: ctid, i, j, p, pk1, pk2, index_bridging_ctid+
 Index index_bridge                                                 +
     Index type: secondary                                          +
     Leaf tuple size: 2, non-leaf tuple size: 1                     +
     Non-leaf tuple fields: index_bridging_ctid                     +
     Leaf tuple fields: index_bridging_ctid, ctid                   +
 Index toast                                                        +
     Index type: secondary                                          +
     Leaf tuple size: 4, non-leaf tuple size: 3                     +
     Non-leaf tuple fields: ctid, attnum, chunknum                  +
     Leaf tuple fields: ctid, attnum, chunknum, data                +
 
(1 row)

INSERT INTO o_test_ix_ams VALUES (1, ARRAY[2,3], point(4, 5), 6, 7);
SELECT orioledb_tbl_structure('o_test_ix_ams'::regclass, 'ne');
                                orioledb_tbl_structure                                 
---------------------------------------------------------------------------------------
 Index ctid_primary contents                                                          +
 Page 0: level = 0, maxKeyLen = 8, nVacatedBytes = 0                                  +
 state = free, datoid equal, relnode equal, ix_type = primary, dirty                  +
     Leftmost, Rightmost                                                              +
   Chunk 0: offset = 0, location = 256, hikey location = 64                           +
     Item 0: offset = 264, tuple = ('(0,1)', '1', '{2,3}', '(4,5)', '6', '7', '(0,1)')+
                                                                                      +
 Index index_bridge contents                                                          +
 Page 0: level = 0, maxKeyLen = 8, nVacatedBytes = 0                                  +
 state = free, datoid equal, relnode equal, ix_type = bridge, dirty                   +
     Leftmost, Rightmost                                                              +
   Chunk 0: offset = 0, location = 256, hikey location = 64                           +
     Item 0: offset = 264, tuple = ('(0,1)', '(0,1)')                                 +
                                                                                      +
 Index toast: not loaded                                                              +
 
(1 row)

EXPLAIN (COSTS OFF)
	SELECT * FROM o_test_ix_ams;
        QUERY PLAN         
---------------------------
 Seq Scan on o_test_ix_ams
(1 row)

SELECT * FROM o_test_ix_ams;
 i |   j   |   p   | pk1 | pk2 
---+-------+-------+-----+-----
 1 | {2,3} | (4,5) |   6 |   7
(1 row)

SELECT orioledb_tbl_structure('o_test_ix_ams'::regclass, 'ne');
                                orioledb_tbl_structure                                 
---------------------------------------------------------------------------------------
 Index ctid_primary contents                                                          +
 Page 0: level = 0, maxKeyLen = 8, nVacatedBytes = 0                                  +
 state = free, datoid equal, relnode equal, ix_type = primary, dirty                  +
     Leftmost, Rightmost                                                              +
   Chunk 0: offset = 0, location = 256, hikey location = 64                           +
     Item 0: offset = 264, tuple = ('(0,1)', '1', '{2,3}', '(4,5)', '6', '7', '(0,1)')+
                                                                                      +
 Index index_bridge contents                                                          +
 Page 0: level = 0, maxKeyLen = 8, nVacatedBytes = 0                                  +
 state = free, datoid equal, relnode equal, ix_type = bridge, dirty                   +
     Leftmost, Rightmost                                                              +
   Chunk 0: offset = 0, location = 256, hikey location = 64                           +
     Item 0: offset = 264, tuple = ('(0,1)', '(0,1)')                                 +
                                                                                      +
 Index toast: not loaded                                                              +
 
(1 row)

CREATE INDEX o_test_ix_ams_ix1 on o_test_ix_ams using btree (j) WITH (index_bridging);
\d+ o_test_ix_ams
                            Table "index_bridging.o_test_ix_ams"
 Column |   Type    | Collation | Nullable | Default | Storage  | Stats target | Description 
--------+-----------+-----------+----------+---------+----------+--------------+-------------
 i      | integer   |           | not null |         | plain    |              | 
 j      | integer[] |           |          |         | extended |              | 
 p      | point     |           |          |         | plain    |              | 
 pk1    | integer   |           |          |         | plain    |              | 
 pk2    | integer   |           |          |         | plain    |              | 
Indexes:
    "o_test_ix_ams_ix1" btree (j) WITH (index_bridging='true')
Options: index_bridging=true

SELECT orioledb_tbl_indices('o_test_ix_ams'::regclass, true);
                        orioledb_tbl_indices                         
---------------------------------------------------------------------
 Index ctid_primary                                                 +
     Index type: primary, unique, ctid                              +
     Leaf tuple size: 7, non-leaf tuple size: 1                     +
     Non-leaf tuple fields: ctid                                    +
     Leaf tuple fields: ctid, i, j, p, pk1, pk2, index_bridging_ctid+
 Index index_bridge                                                 +
     Index type: secondary                                          +
     Leaf tuple size: 2, non-leaf tuple size: 1                     +
     Non-leaf tuple fields: index_bridging_ctid                     +
     Leaf tuple fields: index_bridging_ctid, ctid                   +
 Index toast                                                        +
     Index type: secondary                                          +
     Leaf tuple size: 4, non-leaf tuple size: 3                     +
     Non-leaf tuple fields: ctid, attnum, chunknum                  +
     Leaf tuple fields: ctid, attnum, chunknum, data                +
 
(1 row)

BEGIN;
SET LOCAL enable_seqscan = off;
EXPLAIN (COSTS OFF)
	SELECT * FROM o_test_ix_ams ORDER BY j;
                     QUERY PLAN                      
-----------------------------------------------------
 Index Scan using o_test_ix_ams_ix1 on o_test_ix_ams
(1 row)

SELECT * FROM o_test_ix_ams ORDER BY j;
 i |   j   |   p   | pk1 | pk2 
---+-------+-------+-----+-----
 1 | {2,3} | (4,5) |   6 |   7
(1 row)

COMMIT;
SELECT orioledb_tbl_structure('o_test_ix_ams'::regclass, 'ne');
                                orioledb_tbl_structure                                 
---------------------------------------------------------------------------------------
 Index ctid_primary contents                                                          +
 Page 0: level = 0, maxKeyLen = 8, nVacatedBytes = 0                                  +
 state = free, datoid equal, relnode equal, ix_type = primary, dirty                  +
     Leftmost, Rightmost                                                              +
   Chunk 0: offset = 0, location = 256, hikey location = 64                           +
     Item 0: offset = 264, tuple = ('(0,1)', '1', '{2,3}', '(4,5)', '6', '7', '(0,1)')+
                                                                                      +
 Index index_bridge contents                                                          +
 Page 0: level = 0, maxKeyLen = 8, nVacatedBytes = 0                                  +
 state = free, datoid equal, relnode equal, ix_type = bridge, dirty                   +
     Leftmost, Rightmost                                                              +
   Chunk 0: offset = 0, location = 256, hikey location = 64                           +
     Item 0: offset = 264, tuple = ('(0,1)', '(0,1)')                                 +
                                                                                      +
 Index toast: not loaded                                                              +
 
(1 row)

INSERT INTO o_test_ix_ams VALUES (10, ARRAY[20,30], point(40, 50), 60, 70);
SELECT orioledb_tbl_structure('o_test_ix_ams'::regclass, 'ne');
                                    orioledb_tbl_structure                                    
----------------------------------------------------------------------------------------------
 Index ctid_primary contents                                                                 +
 Page 0: level = 0, maxKeyLen = 8, nVacatedBytes = 0                                         +
 state = free, datoid equal, relnode equal, ix_type = primary, dirty                         +
     Leftmost, Rightmost                                                                     +
   Chunk 0: offset = 0, location = 256, hikey location = 64                                  +
     Item 0: offset = 264, tuple = ('(0,1)', '1', '{2,3}', '(4,5)', '6', '7', '(0,1)')       +
     Item 1: offset = 368, tuple = ('(0,2)', '10', '{20,30}', '(40,50)', '60', '70', '(0,2)')+
                                                                                             +
 Index index_bridge contents                                                                 +
 Page 0: level = 0, maxKeyLen = 8, nVacatedBytes = 0                                         +
 state = free, datoid equal, relnode equal, ix_type = bridge, dirty                          +
     Leftmost, Rightmost                                                                     +
   Chunk 0: offset = 0, location = 256, hikey location = 64                                  +
     Item 0: offset = 264, tuple = ('(0,1)', '(0,1)')                                        +
     Item 1: offset = 296, tuple = ('(0,2)', '(0,2)')                                        +
                                                                                             +
 Index toast: not loaded                                                                     +
 
(1 row)

BEGIN;
SET LOCAL enable_seqscan = off;
EXPLAIN (COSTS OFF)
	SELECT * FROM o_test_ix_ams ORDER BY j;
                     QUERY PLAN                      
-----------------------------------------------------
 Index Scan using o_test_ix_ams_ix1 on o_test_ix_ams
(1 row)

SELECT * FROM o_test_ix_ams ORDER BY j;
 i  |    j    |    p    | pk1 | pk2 
----+---------+---------+-----+-----
  1 | {2,3}   | (4,5)   |   6 |   7
 10 | {20,30} | (40,50) |  60 |  70
(2 rows)

EXPLAIN (COSTS OFF)
	SELECT j FROM o_test_ix_ams ORDER BY j;
                        QUERY PLAN                        
----------------------------------------------------------
 Index Only Scan using o_test_ix_ams_ix1 on o_test_ix_ams
(1 row)

SELECT j FROM o_test_ix_ams ORDER BY j;
    j    
---------
 {2,3}
 {20,30}
(2 rows)

COMMIT;
SELECT orioledb_tbl_indices('o_test_ix_ams'::regclass, true);
                        orioledb_tbl_indices                         
---------------------------------------------------------------------
 Index ctid_primary                                                 +
     Index type: primary, unique, ctid                              +
     Leaf tuple size: 7, non-leaf tuple size: 1                     +
     Non-leaf tuple fields: ctid                                    +
     Leaf tuple fields: ctid, i, j, p, pk1, pk2, index_bridging_ctid+
 Index index_bridge                                                 +
     Index type: secondary                                          +
     Leaf tuple size: 2, non-leaf tuple size: 1                     +
     Non-leaf tuple fields: index_bridging_ctid                     +
     Leaf tuple fields: index_bridging_ctid, ctid                   +
 Index toast                                                        +
     Index type: secondary                                          +
     Leaf tuple size: 4, non-leaf tuple size: 3                     +
     Non-leaf tuple fields: ctid, attnum, chunknum                  +
     Leaf tuple fields: ctid, attnum, chunknum, data                +
 
(1 row)

ALTER TABLE o_test_ix_ams ADD PRIMARY KEY (pk2, pk1);
SELECT orioledb_tbl_indices('o_test_ix_ams'::regclass, true);
                     orioledb_tbl_indices                      
---------------------------------------------------------------
 Index o_test_ix_ams_pkey                                     +
     Index type: primary, unique                              +
     Leaf tuple size: 6, non-leaf tuple size: 2               +
     Non-leaf tuple fields: pk2, pk1                          +
     Leaf tuple fields: i, j, p, pk1, pk2, index_bridging_ctid+
 Index index_bridge                                           +
     Index type: secondary                                    +
     Leaf tuple size: 3, non-leaf tuple size: 1               +
     Non-leaf tuple fields: index_bridging_ctid               +
     Leaf tuple fields: index_bridging_ctid, pk2, pk1         +
 Index toast                                                  +
     Index type: secondary                                    +
     Leaf tuple size: 5, non-leaf tuple size: 4               +
     Non-leaf tuple fields: pk2, pk1, attnum, chunknum        +
     Leaf tuple fields: pk2, pk1, attnum, chunknum, data      +
 
(1 row)

SELECT orioledb_tbl_structure('o_test_ix_ams'::regclass, 'ne');
                               orioledb_tbl_structure                                
-------------------------------------------------------------------------------------
 Index o_test_ix_ams_pkey contents                                                  +
 Page 0: level = 0, maxKeyLen = 8, nVacatedBytes = 0                                +
 state = free, datoid equal, relnode equal, ix_type = primary, clean                +
     Leftmost, Rightmost                                                            +
   Chunk 0: offset = 0, location = 256, hikey location = 64, hikey = ('70', '60')   +
     Item 0: offset = 264, tuple = ('1', '{2,3}', '(4,5)', '6', '7', '(0,1)')       +
   Chunk 1: offset = 1, location = 360, hikey location = 72                         +
     Item 1: offset = 368, tuple = ('10', '{20,30}', '(40,50)', '60', '70', '(0,2)')+
                                                                                    +
 Index index_bridge: not loaded                                                     +
 Index toast: not loaded                                                            +
 
(1 row)

EXPLAIN (COSTS OFF)
	SELECT * FROM o_test_ix_ams;
        QUERY PLAN         
---------------------------
 Seq Scan on o_test_ix_ams
(1 row)

SELECT * FROM o_test_ix_ams;
 i  |    j    |    p    | pk1 | pk2 
----+---------+---------+-----+-----
  1 | {2,3}   | (4,5)   |   6 |   7
 10 | {20,30} | (40,50) |  60 |  70
(2 rows)

BEGIN;
SET LOCAL enable_seqscan = off;
EXPLAIN (COSTS OFF)
	SELECT * FROM o_test_ix_ams ORDER BY j;
                     QUERY PLAN                      
-----------------------------------------------------
 Index Scan using o_test_ix_ams_ix1 on o_test_ix_ams
(1 row)

SELECT * FROM o_test_ix_ams ORDER BY j;
 i  |    j    |    p    | pk1 | pk2 
----+---------+---------+-----+-----
  1 | {2,3}   | (4,5)   |   6 |   7
 10 | {20,30} | (40,50) |  60 |  70
(2 rows)

COMMIT;
SELECT orioledb_tbl_structure('o_test_ix_ams'::regclass, 'ne');
                               orioledb_tbl_structure                                
-------------------------------------------------------------------------------------
 Index o_test_ix_ams_pkey contents                                                  +
 Page 0: level = 0, maxKeyLen = 8, nVacatedBytes = 0                                +
 state = free, datoid equal, relnode equal, ix_type = primary, clean                +
     Leftmost, Rightmost                                                            +
   Chunk 0: offset = 0, location = 256, hikey location = 64, hikey = ('70', '60')   +
     Item 0: offset = 264, tuple = ('1', '{2,3}', '(4,5)', '6', '7', '(0,1)')       +
   Chunk 1: offset = 1, location = 360, hikey location = 72                         +
     Item 1: offset = 368, tuple = ('10', '{20,30}', '(40,50)', '60', '70', '(0,2)')+
                                                                                    +
 Index index_bridge contents                                                        +
 Page 0: level = 0, maxKeyLen = 6, nVacatedBytes = 0                                +
 state = free, datoid equal, relnode equal, ix_type = bridge, clean                 +
     Leftmost, Rightmost                                                            +
   Chunk 0: offset = 0, location = 256, hikey location = 64, hikey = ('(0,2)')      +
     Item 0: offset = 264, tuple = ('(0,1)', '7', '6')                              +
   Chunk 1: offset = 1, location = 296, hikey location = 72                         +
     Item 1: offset = 304, tuple = ('(0,2)', '70', '60')                            +
                                                                                    +
 Index toast: not loaded                                                            +
 
(1 row)

INSERT INTO o_test_ix_ams VALUES (100, ARRAY[200,300], point(400, 500), 600, 700);
SELECT orioledb_tbl_structure('o_test_ix_ams'::regclass, 'ne');
                                   orioledb_tbl_structure                                   
--------------------------------------------------------------------------------------------
 Index o_test_ix_ams_pkey contents                                                         +
 Page 0: level = 0, maxKeyLen = 8, nVacatedBytes = 0                                       +
 state = free, datoid equal, relnode equal, ix_type = primary, dirty                       +
     Leftmost, Rightmost                                                                   +
   Chunk 0: offset = 0, location = 256, hikey location = 64, hikey = ('70', '60')          +
     Item 0: offset = 264, tuple = ('1', '{2,3}', '(4,5)', '6', '7', '(0,1)')              +
   Chunk 1: offset = 1, location = 360, hikey location = 72                                +
     Item 1: offset = 368, tuple = ('10', '{20,30}', '(40,50)', '60', '70', '(0,2)')       +
     Item 2: offset = 464, tuple = ('100', '{200,300}', '(400,500)', '600', '700', '(0,3)')+
                                                                                           +
 Index index_bridge contents                                                               +
 Page 0: level = 0, maxKeyLen = 8, nVacatedBytes = 0                                       +
 state = free, datoid equal, relnode equal, ix_type = bridge, dirty                        +
     Leftmost, Rightmost                                                                   +
   Chunk 0: offset = 0, location = 256, hikey location = 64, hikey = ('(0,2)')             +
     Item 0: offset = 264, tuple = ('(0,1)', '7', '6')                                     +
   Chunk 1: offset = 1, location = 296, hikey location = 72                                +
     Item 1: offset = 304, tuple = ('(0,2)', '70', '60')                                   +
     Item 2: offset = 336, tuple = ('(0,3)', '700', '600')                                 +
                                                                                           +
 Index toast: not loaded                                                                   +
 
(1 row)

EXPLAIN (COSTS OFF)
	SELECT * FROM o_test_ix_ams;
        QUERY PLAN         
---------------------------
 Seq Scan on o_test_ix_ams
(1 row)

SELECT * FROM o_test_ix_ams;
  i  |     j     |     p     | pk1 | pk2 
-----+-----------+-----------+-----+-----
   1 | {2,3}     | (4,5)     |   6 |   7
  10 | {20,30}   | (40,50)   |  60 |  70
 100 | {200,300} | (400,500) | 600 | 700
(3 rows)

BEGIN;
SET LOCAL enable_seqscan = off;
EXPLAIN (COSTS OFF)
	SELECT * FROM o_test_ix_ams ORDER BY j;
                     QUERY PLAN                      
-----------------------------------------------------
 Index Scan using o_test_ix_ams_ix1 on o_test_ix_ams
(1 row)

SELECT * FROM o_test_ix_ams ORDER BY j;
  i  |     j     |     p     | pk1 | pk2 
-----+-----------+-----------+-----+-----
   1 | {2,3}     | (4,5)     |   6 |   7
  10 | {20,30}   | (40,50)   |  60 |  70
 100 | {200,300} | (400,500) | 600 | 700
(3 rows)

COMMIT;
SELECT orioledb_tbl_structure('o_test_ix_ams'::regclass, 'ne');
                                   orioledb_tbl_structure                                   
--------------------------------------------------------------------------------------------
 Index o_test_ix_ams_pkey contents                                                         +
 Page 0: level = 0, maxKeyLen = 8, nVacatedBytes = 0                                       +
 state = free, datoid equal, relnode equal, ix_type = primary, dirty                       +
     Leftmost, Rightmost                                                                   +
   Chunk 0: offset = 0, location = 256, hikey location = 64, hikey = ('70', '60')          +
     Item 0: offset = 264, tuple = ('1', '{2,3}', '(4,5)', '6', '7', '(0,1)')              +
   Chunk 1: offset = 1, location = 360, hikey location = 72                                +
     Item 1: offset = 368, tuple = ('10', '{20,30}', '(40,50)', '60', '70', '(0,2)')       +
     Item 2: offset = 464, tuple = ('100', '{200,300}', '(400,500)', '600', '700', '(0,3)')+
                                                                                           +
 Index index_bridge contents                                                               +
 Page 0: level = 0, maxKeyLen = 8, nVacatedBytes = 0                                       +
 state = free, datoid equal, relnode equal, ix_type = bridge, dirty                        +
     Leftmost, Rightmost                                                                   +
   Chunk 0: offset = 0, location = 256, hikey location = 64, hikey = ('(0,2)')             +
     Item 0: offset = 264, tuple = ('(0,1)', '7', '6')                                     +
   Chunk 1: offset = 1, location = 296, hikey location = 72                                +
     Item 1: offset = 304, tuple = ('(0,2)', '70', '60')                                   +
     Item 2: offset = 336, tuple = ('(0,3)', '700', '600')                                 +
                                                                                           +
 Index toast: not loaded                                                                   +
 
(1 row)

SELECT orioledb_tbl_indices('o_test_ix_ams'::regclass, true);
                     orioledb_tbl_indices                      
---------------------------------------------------------------
 Index o_test_ix_ams_pkey                                     +
     Index type: primary, unique                              +
     Leaf tuple size: 6, non-leaf tuple size: 2               +
     Non-leaf tuple fields: pk2, pk1                          +
     Leaf tuple fields: i, j, p, pk1, pk2, index_bridging_ctid+
 Index index_bridge                                           +
     Index type: secondary                                    +
     Leaf tuple size: 3, non-leaf tuple size: 1               +
     Non-leaf tuple fields: index_bridging_ctid               +
     Leaf tuple fields: index_bridging_ctid, pk2, pk1         +
 Index toast                                                  +
     Index type: secondary                                    +
     Leaf tuple size: 5, non-leaf tuple size: 4               +
     Non-leaf tuple fields: pk2, pk1, attnum, chunknum        +
     Leaf tuple fields: pk2, pk1, attnum, chunknum, data      +
 
(1 row)

ALTER TABLE o_test_ix_ams DROP CONSTRAINT o_test_ix_ams_pkey;
SELECT orioledb_tbl_indices('o_test_ix_ams'::regclass, true);
                        orioledb_tbl_indices                         
---------------------------------------------------------------------
 Index ctid_primary                                                 +
     Index type: primary, unique, ctid                              +
     Leaf tuple size: 7, non-leaf tuple size: 1                     +
     Non-leaf tuple fields: ctid                                    +
     Leaf tuple fields: ctid, i, j, p, pk1, pk2, index_bridging_ctid+
 Index index_bridge                                                 +
     Index type: secondary                                          +
     Leaf tuple size: 2, non-leaf tuple size: 1                     +
     Non-leaf tuple fields: index_bridging_ctid                     +
     Leaf tuple fields: index_bridging_ctid, ctid                   +
 Index toast                                                        +
     Index type: secondary                                          +
     Leaf tuple size: 4, non-leaf tuple size: 3                     +
     Non-leaf tuple fields: ctid, attnum, chunknum                  +
     Leaf tuple fields: ctid, attnum, chunknum, data                +
 
(1 row)

EXPLAIN (COSTS OFF)
	SELECT * FROM o_test_ix_ams;
        QUERY PLAN         
---------------------------
 Seq Scan on o_test_ix_ams
(1 row)

SELECT * FROM o_test_ix_ams;
  i  |     j     |     p     | pk1 | pk2 
-----+-----------+-----------+-----+-----
   1 | {2,3}     | (4,5)     |   6 |   7
  10 | {20,30}   | (40,50)   |  60 |  70
 100 | {200,300} | (400,500) | 600 | 700
(3 rows)

BEGIN;
SET LOCAL enable_seqscan = off;
EXPLAIN (COSTS OFF)
	SELECT * FROM o_test_ix_ams ORDER BY j;
                     QUERY PLAN                      
-----------------------------------------------------
 Index Scan using o_test_ix_ams_ix1 on o_test_ix_ams
(1 row)

SELECT * FROM o_test_ix_ams ORDER BY j;
  i  |     j     |     p     | pk1 | pk2 
-----+-----------+-----------+-----+-----
   1 | {2,3}     | (4,5)     |   6 |   7
  10 | {20,30}   | (40,50)   |  60 |  70
 100 | {200,300} | (400,500) | 600 | 700
(3 rows)

COMMIT;
SELECT orioledb_tbl_structure('o_test_ix_ams'::regclass, 'ne');
                                       orioledb_tbl_structure                                        
-----------------------------------------------------------------------------------------------------
 Index ctid_primary contents                                                                        +
 Page 0: level = 0, maxKeyLen = 6, nVacatedBytes = 0                                                +
 state = free, datoid equal, relnode equal, ix_type = primary, clean                                +
     Leftmost, Rightmost                                                                            +
   Chunk 0: offset = 0, location = 256, hikey location = 72, hikey = ('(0,1)')                      +
     Item 0: offset = 264, tuple = ('(0,0)', '1', '{2,3}', '(4,5)', '6', '7', '(0,1)')              +
   Chunk 1: offset = 1, location = 368, hikey location = 80, hikey = ('(0,2)')                      +
     Item 1: offset = 376, tuple = ('(0,1)', '10', '{20,30}', '(40,50)', '60', '70', '(0,2)')       +
   Chunk 2: offset = 2, location = 480, hikey location = 88                                         +
     Item 2: offset = 488, tuple = ('(0,2)', '100', '{200,300}', '(400,500)', '600', '700', '(0,3)')+
                                                                                                    +
 Index index_bridge contents                                                                        +
 Page 0: level = 0, maxKeyLen = 6, nVacatedBytes = 0                                                +
 state = free, datoid equal, relnode equal, ix_type = bridge, clean                                 +
     Leftmost, Rightmost                                                                            +
   Chunk 0: offset = 0, location = 256, hikey location = 72, hikey = ('(0,2)')                      +
     Item 0: offset = 264, tuple = ('(0,1)', '(0,0)')                                               +
   Chunk 1: offset = 1, location = 296, hikey location = 80, hikey = ('(0,3)')                      +
     Item 1: offset = 304, tuple = ('(0,2)', '(0,1)')                                               +
   Chunk 2: offset = 2, location = 336, hikey location = 88                                         +
     Item 2: offset = 344, tuple = ('(0,3)', '(0,2)')                                               +
                                                                                                    +
 Index toast: not loaded                                                                            +
 
(1 row)

SELECT orioledb_table_description('o_test_ix_ams'::regclass);
                orioledb_table_description                 
-----------------------------------------------------------
 Compress = -1, Primary compress = -1, TOAST compress = -1+
  Column |      Type | Collation | Nullable | Droped      +
       i |   integer |    (null) |    false |  false      +
       j | integer[] |    (null) |     true |  false      +
       p |     point |    (null) |     true |  false      +
     pk1 |   integer |    (null) |    false |  false      +
     pk2 |   integer |    (null) |    false |  false      +
 
(1 row)

SELECT orioledb_tbl_indices('o_test_ix_ams'::regclass, true);
                        orioledb_tbl_indices                         
---------------------------------------------------------------------
 Index ctid_primary                                                 +
     Index type: primary, unique, ctid                              +
     Leaf tuple size: 7, non-leaf tuple size: 1                     +
     Non-leaf tuple fields: ctid                                    +
     Leaf tuple fields: ctid, i, j, p, pk1, pk2, index_bridging_ctid+
 Index index_bridge                                                 +
     Index type: secondary                                          +
     Leaf tuple size: 2, non-leaf tuple size: 1                     +
     Non-leaf tuple fields: index_bridging_ctid                     +
     Leaf tuple fields: index_bridging_ctid, ctid                   +
 Index toast                                                        +
     Index type: secondary                                          +
     Leaf tuple size: 4, non-leaf tuple size: 3                     +
     Non-leaf tuple fields: ctid, attnum, chunknum                  +
     Leaf tuple fields: ctid, attnum, chunknum, data                +
 
(1 row)

ALTER TABLE o_test_ix_ams ALTER j TYPE int USING 200-j[1];
SELECT orioledb_table_description('o_test_ix_ams'::regclass);
                orioledb_table_description                 
-----------------------------------------------------------
 Compress = -1, Primary compress = -1, TOAST compress = -1+
  Column |    Type | Collation | Nullable | Droped        +
       i | integer |    (null) |    false |  false        +
       j | integer |    (null) |     true |  false        +
       p |   point |    (null) |     true |  false        +
     pk1 | integer |    (null) |    false |  false        +
     pk2 | integer |    (null) |    false |  false        +
 
(1 row)

SELECT orioledb_tbl_indices('o_test_ix_ams'::regclass, true);
                        orioledb_tbl_indices                         
---------------------------------------------------------------------
 Index ctid_primary                                                 +
     Index type: primary, unique, ctid                              +
     Leaf tuple size: 7, non-leaf tuple size: 1                     +
     Non-leaf tuple fields: ctid                                    +
     Leaf tuple fields: ctid, i, j, p, pk1, pk2, index_bridging_ctid+
 Index index_bridge                                                 +
     Index type: secondary                                          +
     Leaf tuple size: 2, non-leaf tuple size: 1                     +
     Non-leaf tuple fields: index_bridging_ctid                     +
     Leaf tuple fields: index_bridging_ctid, ctid                   +
 Index toast                                                        +
     Index type: secondary                                          +
     Leaf tuple size: 4, non-leaf tuple size: 3                     +
     Non-leaf tuple fields: ctid, attnum, chunknum                  +
     Leaf tuple fields: ctid, attnum, chunknum, data                +
 
(1 row)

EXPLAIN (COSTS OFF)
	SELECT * FROM o_test_ix_ams;
        QUERY PLAN         
---------------------------
 Seq Scan on o_test_ix_ams
(1 row)

SELECT * FROM o_test_ix_ams;
  i  |  j  |     p     | pk1 | pk2 
-----+-----+-----------+-----+-----
   1 | 198 | (4,5)     |   6 |   7
  10 | 180 | (40,50)   |  60 |  70
 100 |   0 | (400,500) | 600 | 700
(3 rows)

BEGIN;
SET LOCAL enable_seqscan = off;
EXPLAIN (COSTS OFF)
	SELECT * FROM o_test_ix_ams ORDER BY j;
                     QUERY PLAN                      
-----------------------------------------------------
 Index Scan using o_test_ix_ams_ix1 on o_test_ix_ams
(1 row)

SELECT * FROM o_test_ix_ams ORDER BY j;
  i  |  j  |     p     | pk1 | pk2 
-----+-----+-----------+-----+-----
 100 |   0 | (400,500) | 600 | 700
  10 | 180 | (40,50)   |  60 |  70
   1 | 198 | (4,5)     |   6 |   7
(3 rows)

COMMIT;
SELECT orioledb_tbl_structure('o_test_ix_ams'::regclass, 'ne');
                                   orioledb_tbl_structure                                    
---------------------------------------------------------------------------------------------
 Index ctid_primary contents                                                                +
 Page 0: level = 0, maxKeyLen = 8, nVacatedBytes = 0                                        +
 state = free, datoid equal, relnode equal, ix_type = primary, dirty                        +
     Leftmost, Rightmost                                                                    +
   Chunk 0: offset = 0, location = 256, hikey location = 64                                 +
     Item 0: offset = 264, tuple = ('(0,1)', '1', '198', '(4,5)', '6', '7', '(0,1)')        +
     Item 1: offset = 336, tuple = ('(0,2)', '10', '180', '(40,50)', '60', '70', '(0,2)')   +
     Item 2: offset = 408, tuple = ('(0,3)', '100', '0', '(400,500)', '600', '700', '(0,3)')+
                                                                                            +
 Index index_bridge contents                                                                +
 Page 0: level = 0, maxKeyLen = 8, nVacatedBytes = 0                                        +
 state = free, datoid equal, relnode equal, ix_type = bridge, dirty                         +
     Leftmost, Rightmost                                                                    +
   Chunk 0: offset = 0, location = 256, hikey location = 64                                 +
     Item 0: offset = 264, tuple = ('(0,1)', '(0,1)')                                       +
     Item 1: offset = 296, tuple = ('(0,2)', '(0,2)')                                       +
     Item 2: offset = 328, tuple = ('(0,3)', '(0,3)')                                       +
                                                                                            +
 Index toast: not loaded                                                                    +
 
(1 row)

ALTER TABLE o_test_ix_ams ADD COLUMN k int;
BEGIN;
SET LOCAL enable_seqscan = off;
EXPLAIN (COSTS OFF)
	SELECT * FROM o_test_ix_ams ORDER BY j;
                     QUERY PLAN                      
-----------------------------------------------------
 Index Scan using o_test_ix_ams_ix1 on o_test_ix_ams
(1 row)

SELECT * FROM o_test_ix_ams ORDER BY j;
  i  |  j  |     p     | pk1 | pk2 | k 
-----+-----+-----------+-----+-----+---
 100 |   0 | (400,500) | 600 | 700 | 0
  10 | 180 | (40,50)   |  60 |  70 | 0
   1 | 198 | (4,5)     |   6 |   7 | 0
(3 rows)

COMMIT;
UPDATE o_test_ix_ams SET k = j/2 + 1000;
SELECT orioledb_tbl_structure('o_test_ix_ams'::regclass, 'ne');
                                       orioledb_tbl_structure                                        
-----------------------------------------------------------------------------------------------------
 Index ctid_primary contents                                                                        +
 Page 0: level = 0, maxKeyLen = 8, nVacatedBytes = 0                                                +
 state = free, datoid equal, relnode equal, ix_type = primary, dirty                                +
     Leftmost, Rightmost                                                                            +
   Chunk 0: offset = 0, location = 256, hikey location = 64                                         +
     Item 0: offset = 264, tuple = ('(0,1)', '1', '198', '(4,5)', '6', '7', '1099', '(0,4)')        +
     Item 1: offset = 344, tuple = ('(0,2)', '10', '180', '(40,50)', '60', '70', '1090', '(0,5)')   +
     Item 2: offset = 424, tuple = ('(0,3)', '100', '0', '(400,500)', '600', '700', '1000', '(0,6)')+
                                                                                                    +
 Index index_bridge contents                                                                        +
 Page 0: level = 0, maxKeyLen = 8, nVacatedBytes = 0                                                +
 state = free, datoid equal, relnode equal, ix_type = bridge, dirty                                 +
     Leftmost, Rightmost                                                                            +
   Chunk 0: offset = 0, location = 256, hikey location = 64                                         +
     Item 0: offset = 272, tuple = ('(0,1)', '(0,1)')                                               +
     Item 1: offset = 304, tuple = ('(0,2)', '(0,2)')                                               +
     Item 2: offset = 336, tuple = ('(0,3)', '(0,3)')                                               +
     Item 3: offset = 368, tuple = ('(0,4)', '(0,1)')                                               +
     Item 4: offset = 400, tuple = ('(0,5)', '(0,2)')                                               +
     Item 5: offset = 432, tuple = ('(0,6)', '(0,3)')                                               +
                                                                                                    +
 Index toast: not loaded                                                                            +
 
(1 row)

BEGIN;
SET LOCAL enable_seqscan = off;
EXPLAIN (COSTS OFF)
	SELECT * FROM o_test_ix_ams ORDER BY j;
                     QUERY PLAN                      
-----------------------------------------------------
 Index Scan using o_test_ix_ams_ix1 on o_test_ix_ams
(1 row)

SELECT * FROM o_test_ix_ams ORDER BY j;
  i  |  j  |     p     | pk1 | pk2 |  k   
-----+-----+-----------+-----+-----+------
 100 |   0 | (400,500) | 600 | 700 | 1000
  10 | 180 | (40,50)   |  60 |  70 | 1090
   1 | 198 | (4,5)     |   6 |   7 | 1099
(3 rows)

COMMIT;
CREATE INDEX o_test_ix_ams_ix2 on o_test_ix_ams using btree (k) WITH (index_bridging);
SELECT orioledb_tbl_indices('o_test_ix_ams'::regclass, true);
                          orioledb_tbl_indices                          
------------------------------------------------------------------------
 Index ctid_primary                                                    +
     Index type: primary, unique, ctid                                 +
     Leaf tuple size: 8, non-leaf tuple size: 1                        +
     Non-leaf tuple fields: ctid                                       +
     Leaf tuple fields: ctid, i, j, p, pk1, pk2, k, index_bridging_ctid+
 Index index_bridge                                                    +
     Index type: secondary                                             +
     Leaf tuple size: 2, non-leaf tuple size: 1                        +
     Non-leaf tuple fields: index_bridging_ctid                        +
     Leaf tuple fields: index_bridging_ctid, ctid                      +
 Index toast                                                           +
     Index type: secondary                                             +
     Leaf tuple size: 4, non-leaf tuple size: 3                        +
     Non-leaf tuple fields: ctid, attnum, chunknum                     +
     Leaf tuple fields: ctid, attnum, chunknum, data                   +
 
(1 row)

BEGIN;
SET LOCAL enable_seqscan = off;
EXPLAIN (COSTS OFF)
	SELECT * FROM o_test_ix_ams ORDER BY k;
                     QUERY PLAN                      
-----------------------------------------------------
 Index Scan using o_test_ix_ams_ix2 on o_test_ix_ams
(1 row)

SELECT * FROM o_test_ix_ams ORDER BY k;
  i  |  j  |     p     | pk1 | pk2 |  k   
-----+-----+-----------+-----+-----+------
 100 |   0 | (400,500) | 600 | 700 | 1000
  10 | 180 | (40,50)   |  60 |  70 | 1090
   1 | 198 | (4,5)     |   6 |   7 | 1099
(3 rows)

COMMIT;
SELECT orioledb_tbl_structure('o_test_ix_ams'::regclass, 'ne');
                                       orioledb_tbl_structure                                        
-----------------------------------------------------------------------------------------------------
 Index ctid_primary contents                                                                        +
 Page 0: level = 0, maxKeyLen = 8, nVacatedBytes = 0                                                +
 state = free, datoid equal, relnode equal, ix_type = primary, dirty                                +
     Leftmost, Rightmost                                                                            +
   Chunk 0: offset = 0, location = 256, hikey location = 64                                         +
     Item 0: offset = 264, tuple = ('(0,1)', '1', '198', '(4,5)', '6', '7', '1099', '(0,4)')        +
     Item 1: offset = 344, tuple = ('(0,2)', '10', '180', '(40,50)', '60', '70', '1090', '(0,5)')   +
     Item 2: offset = 424, tuple = ('(0,3)', '100', '0', '(400,500)', '600', '700', '1000', '(0,6)')+
                                                                                                    +
 Index index_bridge contents                                                                        +
 Page 0: level = 0, maxKeyLen = 8, nVacatedBytes = 0                                                +
 state = free, datoid equal, relnode equal, ix_type = bridge, dirty                                 +
     Leftmost, Rightmost                                                                            +
   Chunk 0: offset = 0, location = 256, hikey location = 64                                         +
     Item 0: offset = 272, tuple = ('(0,1)', '(0,1)')                                               +
     Item 1: offset = 304, tuple = ('(0,2)', '(0,2)')                                               +
     Item 2: offset = 336, tuple = ('(0,3)', '(0,3)')                                               +
     Item 3: offset = 368, tuple = ('(0,4)', '(0,1)')                                               +
     Item 4: offset = 400, tuple = ('(0,5)', '(0,2)')                                               +
     Item 5: offset = 432, tuple = ('(0,6)', '(0,3)')                                               +
                                                                                                    +
 Index toast: not loaded                                                                            +
 
(1 row)

INSERT INTO o_test_ix_ams VALUES (1000, 2000, point(4000, 5000), 6000, 7000, 8000);
SELECT orioledb_tbl_structure('o_test_ix_ams'::regclass, 'ne');
                                           orioledb_tbl_structure                                            
-------------------------------------------------------------------------------------------------------------
 Index ctid_primary contents                                                                                +
 Page 0: level = 0, maxKeyLen = 8, nVacatedBytes = 0                                                        +
 state = free, datoid equal, relnode equal, ix_type = primary, dirty                                        +
     Leftmost, Rightmost                                                                                    +
   Chunk 0: offset = 0, location = 256, hikey location = 64                                                 +
     Item 0: offset = 264, tuple = ('(0,1)', '1', '198', '(4,5)', '6', '7', '1099', '(0,4)')                +
     Item 1: offset = 344, tuple = ('(0,2)', '10', '180', '(40,50)', '60', '70', '1090', '(0,5)')           +
     Item 2: offset = 424, tuple = ('(0,3)', '100', '0', '(400,500)', '600', '700', '1000', '(0,6)')        +
     Item 3: offset = 504, tuple = ('(0,4)', '1000', '2000', '(4000,5000)', '6000', '7000', '8000', '(0,7)')+
                                                                                                            +
 Index index_bridge contents                                                                                +
 Page 0: level = 0, maxKeyLen = 8, nVacatedBytes = 0                                                        +
 state = free, datoid equal, relnode equal, ix_type = bridge, dirty                                         +
     Leftmost, Rightmost                                                                                    +
   Chunk 0: offset = 0, location = 256, hikey location = 64                                                 +
     Item 0: offset = 272, tuple = ('(0,1)', '(0,1)')                                                       +
     Item 1: offset = 304, tuple = ('(0,2)', '(0,2)')                                                       +
     Item 2: offset = 336, tuple = ('(0,3)', '(0,3)')                                                       +
     Item 3: offset = 368, tuple = ('(0,4)', '(0,1)')                                                       +
     Item 4: offset = 400, tuple = ('(0,5)', '(0,2)')                                                       +
     Item 5: offset = 432, tuple = ('(0,6)', '(0,3)')                                                       +
     Item 6: offset = 464, tuple = ('(0,7)', '(0,4)')                                                       +
                                                                                                            +
 Index toast: not loaded                                                                                    +
 
(1 row)

BEGIN;
SET LOCAL enable_seqscan = off;
EXPLAIN (COSTS OFF)
	SELECT * FROM o_test_ix_ams ORDER BY k;
                     QUERY PLAN                      
-----------------------------------------------------
 Index Scan using o_test_ix_ams_ix2 on o_test_ix_ams
(1 row)

SELECT * FROM o_test_ix_ams ORDER BY k;
  i   |  j   |      p      | pk1  | pk2  |  k   
------+------+-------------+------+------+------
  100 |    0 | (400,500)   |  600 |  700 | 1000
   10 |  180 | (40,50)     |   60 |   70 | 1090
    1 |  198 | (4,5)       |    6 |    7 | 1099
 1000 | 2000 | (4000,5000) | 6000 | 7000 | 8000
(4 rows)

COMMIT;
DROP INDEX o_test_ix_ams_ix2;
CREATE INDEX o_test_ix_ams_hash_ix ON o_test_ix_ams USING hash (k);
\d+ o_test_ix_ams
                           Table "index_bridging.o_test_ix_ams"
 Column |  Type   | Collation | Nullable | Default | Storage | Stats target | Description 
--------+---------+-----------+----------+---------+---------+--------------+-------------
 i      | integer |           | not null |         | plain   |              | 
 j      | integer |           |          |         | plain   |              | 
 p      | point   |           |          |         | plain   |              | 
 pk1    | integer |           | not null |         | plain   |              | 
 pk2    | integer |           | not null |         | plain   |              | 
 k      | integer |           |          |         | plain   |              | 
Indexes:
    "o_test_ix_ams_hash_ix" hash (k)
    "o_test_ix_ams_ix1" btree (j) WITH (index_bridging='true')
Options: index_bridging=true

SELECT orioledb_tbl_indices('o_test_ix_ams'::regclass, true);
                          orioledb_tbl_indices                          
------------------------------------------------------------------------
 Index ctid_primary                                                    +
     Index type: primary, unique, ctid                                 +
     Leaf tuple size: 8, non-leaf tuple size: 1                        +
     Non-leaf tuple fields: ctid                                       +
     Leaf tuple fields: ctid, i, j, p, pk1, pk2, k, index_bridging_ctid+
 Index index_bridge                                                    +
     Index type: secondary                                             +
     Leaf tuple size: 2, non-leaf tuple size: 1                        +
     Non-leaf tuple fields: index_bridging_ctid                        +
     Leaf tuple fields: index_bridging_ctid, ctid                      +
 Index toast                                                           +
     Index type: secondary                                             +
     Leaf tuple size: 4, non-leaf tuple size: 3                        +
     Non-leaf tuple fields: ctid, attnum, chunknum                     +
     Leaf tuple fields: ctid, attnum, chunknum, data                   +
 
(1 row)

BEGIN;
SET LOCAL enable_seqscan = off;
EXPLAIN (COSTS OFF)
	SELECT * FROM o_test_ix_ams WHERE k = 8000;
                       QUERY PLAN                        
---------------------------------------------------------
 Index Scan using o_test_ix_ams_hash_ix on o_test_ix_ams
   Index Cond: (k = 8000)
(2 rows)

SELECT * FROM o_test_ix_ams WHERE k = 8000;
  i   |  j   |      p      | pk1  | pk2  |  k   
------+------+-------------+------+------+------
 1000 | 2000 | (4000,5000) | 6000 | 7000 | 8000
(1 row)

COMMIT;
BEGIN;
SET LOCAL enable_seqscan = off;
SET LOCAL enable_indexscan = off;
EXPLAIN (COSTS OFF)
	SELECT * FROM o_test_ix_ams WHERE j < 2100;
                  QUERY PLAN                  
----------------------------------------------
 Custom Scan (o_scan) on o_test_ix_ams
   Bitmap heap scan
   Recheck Cond: (j < 2100)
   ->  Bitmap Index Scan on o_test_ix_ams_ix1
         Index Cond: (j < 2100)
(5 rows)

SELECT * FROM o_test_ix_ams WHERE j < 2100;
  i   |  j   |      p      | pk1  | pk2  |  k   
------+------+-------------+------+------+------
    1 |  198 | (4,5)       |    6 |    7 | 1099
   10 |  180 | (40,50)     |   60 |   70 | 1090
  100 |    0 | (400,500)   |  600 |  700 | 1000
 1000 | 2000 | (4000,5000) | 6000 | 7000 | 8000
(4 rows)

COMMIT;
BEGIN;
SET LOCAL enable_seqscan = off;
SET LOCAL enable_indexscan = off;
EXPLAIN (COSTS OFF)
	SELECT * FROM o_test_ix_ams WHERE k = 8000;
                    QUERY PLAN                    
--------------------------------------------------
 Custom Scan (o_scan) on o_test_ix_ams
   Bitmap heap scan
   Recheck Cond: (k = 8000)
   ->  Bitmap Index Scan on o_test_ix_ams_hash_ix
         Index Cond: (k = 8000)
(5 rows)

SELECT * FROM o_test_ix_ams WHERE k = 8000;
  i   |  j   |      p      | pk1  | pk2  |  k   
------+------+-------------+------+------+------
 1000 | 2000 | (4000,5000) | 6000 | 7000 | 8000
(1 row)

COMMIT;
ALTER TABLE o_test_ix_ams ADD COLUMN r int4[];
UPDATE o_test_ix_ams SET r = ARRAY[(i*8+j)%100, 11];
SELECT orioledb_table_description('o_test_ix_ams'::regclass);
                orioledb_table_description                 
-----------------------------------------------------------
 Compress = -1, Primary compress = -1, TOAST compress = -1+
  Column |      Type | Collation | Nullable | Droped      +
       i |   integer |    (null) |    false |  false      +
       j |   integer |    (null) |     true |  false      +
       p |     point |    (null) |     true |  false      +
     pk1 |   integer |    (null) |    false |  false      +
     pk2 |   integer |    (null) |    false |  false      +
       k |   integer |    (null) |     true |  false      +
       r | integer[] |    (null) |     true |  false      +
 
(1 row)

\d+ o_test_ix_ams
                            Table "index_bridging.o_test_ix_ams"
 Column |   Type    | Collation | Nullable | Default | Storage  | Stats target | Description 
--------+-----------+-----------+----------+---------+----------+--------------+-------------
 i      | integer   |           | not null |         | plain    |              | 
 j      | integer   |           |          |         | plain    |              | 
 p      | point     |           |          |         | plain    |              | 
 pk1    | integer   |           | not null |         | plain    |              | 
 pk2    | integer   |           | not null |         | plain    |              | 
 k      | integer   |           |          |         | plain    |              | 
 r      | integer[] |           |          |         | extended |              | 
Indexes:
    "o_test_ix_ams_hash_ix" hash (k)
    "o_test_ix_ams_ix1" btree (j) WITH (index_bridging='true')
Options: index_bridging=true

SELECT orioledb_tbl_indices('o_test_ix_ams'::regclass, true);
                           orioledb_tbl_indices                            
---------------------------------------------------------------------------
 Index ctid_primary                                                       +
     Index type: primary, unique, ctid                                    +
     Leaf tuple size: 9, non-leaf tuple size: 1                           +
     Non-leaf tuple fields: ctid                                          +
     Leaf tuple fields: ctid, i, j, p, pk1, pk2, k, r, index_bridging_ctid+
 Index index_bridge                                                       +
     Index type: secondary                                                +
     Leaf tuple size: 2, non-leaf tuple size: 1                           +
     Non-leaf tuple fields: index_bridging_ctid                           +
     Leaf tuple fields: index_bridging_ctid, ctid                         +
 Index toast                                                              +
     Index type: secondary                                                +
     Leaf tuple size: 4, non-leaf tuple size: 3                           +
     Non-leaf tuple fields: ctid, attnum, chunknum                        +
     Leaf tuple fields: ctid, attnum, chunknum, data                      +
 
(1 row)

SELECT orioledb_tbl_structure('o_test_ix_ams'::regclass, 'ne');
                                                 orioledb_tbl_structure                                                 
------------------------------------------------------------------------------------------------------------------------
 Index ctid_primary contents                                                                                           +
 Page 0: level = 0, maxKeyLen = 8, nVacatedBytes = 0                                                                   +
 state = free, datoid equal, relnode equal, ix_type = primary, dirty                                                   +
     Leftmost, Rightmost                                                                                               +
   Chunk 0: offset = 0, location = 256, hikey location = 64                                                            +
     Item 0: offset = 264, tuple = ('(0,1)', '1', '198', '(4,5)', '6', '7', '1099', '{6,11}', '(0,8)')                 +
     Item 1: offset = 368, tuple = ('(0,2)', '10', '180', '(40,50)', '60', '70', '1090', '{60,11}', '(0,9)')           +
     Item 2: offset = 472, tuple = ('(0,3)', '100', '0', '(400,500)', '600', '700', '1000', '{0,11}', '(0,10)')        +
     Item 3: offset = 576, tuple = ('(0,4)', '1000', '2000', '(4000,5000)', '6000', '7000', '8000', '{0,11}', '(0,11)')+
                                                                                                                       +
 Index index_bridge contents                                                                                           +
 Page 0: level = 0, maxKeyLen = 8, nVacatedBytes = 0                                                                   +
 state = free, datoid equal, relnode equal, ix_type = bridge, dirty                                                    +
     Leftmost, Rightmost                                                                                               +
   Chunk 0: offset = 0, location = 256, hikey location = 64                                                            +
     Item 0: offset = 280, tuple = ('(0,1)', '(0,1)')                                                                  +
     Item 1: offset = 312, tuple = ('(0,2)', '(0,2)')                                                                  +
     Item 2: offset = 344, tuple = ('(0,3)', '(0,3)')                                                                  +
     Item 3: offset = 376, tuple = ('(0,4)', '(0,1)')                                                                  +
     Item 4: offset = 408, tuple = ('(0,5)', '(0,2)')                                                                  +
     Item 5: offset = 440, tuple = ('(0,6)', '(0,3)')                                                                  +
     Item 6: offset = 472, tuple = ('(0,7)', '(0,4)')                                                                  +
     Item 7: offset = 504, tuple = ('(0,8)', '(0,1)')                                                                  +
     Item 8: offset = 536, tuple = ('(0,9)', '(0,2)')                                                                  +
     Item 9: offset = 568, tuple = ('(0,10)', '(0,3)')                                                                 +
     Item 10: offset = 600, tuple = ('(0,11)', '(0,4)')                                                                +
                                                                                                                       +
 Index toast: not loaded                                                                                               +
 
(1 row)

SELECT * FROM o_test_ix_ams;
  i   |  j   |      p      | pk1  | pk2  |  k   |    r    
------+------+-------------+------+------+------+---------
    1 |  198 | (4,5)       |    6 |    7 | 1099 | {6,11}
   10 |  180 | (40,50)     |   60 |   70 | 1090 | {60,11}
  100 |    0 | (400,500)   |  600 |  700 | 1000 | {0,11}
 1000 | 2000 | (4000,5000) | 6000 | 7000 | 8000 | {0,11}
(4 rows)

CREATE INDEX o_test_ix_ams_ix3 ON o_test_ix_ams USING gin (r);
BEGIN;
SET LOCAL enable_seqscan = off;
SET LOCAL enable_bitmapscan = off;
EXPLAIN (COSTS OFF)
	SELECT * FROM o_test_ix_ams WHERE r @> array[11, 11];
              QUERY PLAN               
---------------------------------------
 Seq Scan on o_test_ix_ams
   Filter: (r @> '{11,11}'::integer[])
(2 rows)

SELECT * FROM o_test_ix_ams WHERE r @> array[11, 11];
  i   |  j   |      p      | pk1  | pk2  |  k   |    r    
------+------+-------------+------+------+------+---------
    1 |  198 | (4,5)       |    6 |    7 | 1099 | {6,11}
   10 |  180 | (40,50)     |   60 |   70 | 1090 | {60,11}
  100 |    0 | (400,500)   |  600 |  700 | 1000 | {0,11}
 1000 | 2000 | (4000,5000) | 6000 | 7000 | 8000 | {0,11}
(4 rows)

COMMIT;
CREATE INDEX o_test_ix_ams_ix4 ON o_test_ix_ams USING gist (p);
BEGIN;
SET LOCAL enable_seqscan = off;
EXPLAIN (COSTS OFF)
	SELECT p FROM o_test_ix_ams WHERE p <@ box(point(0,0), point(4000, 5000));
                        QUERY PLAN                        
----------------------------------------------------------
 Index Only Scan using o_test_ix_ams_ix4 on o_test_ix_ams
   Index Cond: (p <@ '(4000,5000),(0,0)'::box)
(2 rows)

SELECT p FROM o_test_ix_ams WHERE p <@ box(point(0,0), point(4000, 5000));
      p      
-------------
 (4,5)
 (40,50)
 (400,500)
 (4000,5000)
(4 rows)

COMMIT;
CREATE EXTENSION pageinspect;
CREATE TABLE o_briging_vacuum_test (id serial primary key, val float, p point) USING orioledb WITH (index_bridging);
INSERT INTO o_briging_vacuum_test (p) (SELECT point(0.01 * i, 0.02 * i) FROM generate_series(1,5) i);
SELECT orioledb_tbl_structure('o_briging_vacuum_test'::regclass, 'ne');
                        orioledb_tbl_structure                         
-----------------------------------------------------------------------
 Index o_briging_vacuum_test_pkey contents                            +
 Page 0: level = 0, maxKeyLen = 8, nVacatedBytes = 0                  +
 state = free, datoid equal, relnode equal, ix_type = primary, dirty  +
     Leftmost, Rightmost                                              +
   Chunk 0: offset = 0, location = 256, hikey location = 64           +
     Item 0: offset = 272, tuple = ('1', null, '(0.01,0.02)', '(0,1)')+
     Item 1: offset = 336, tuple = ('2', null, '(0.02,0.04)', '(0,2)')+
     Item 2: offset = 400, tuple = ('3', null, '(0.03,0.06)', '(0,3)')+
     Item 3: offset = 464, tuple = ('4', null, '(0.04,0.08)', '(0,4)')+
     Item 4: offset = 528, tuple = ('5', null, '(0.05,0.1)', '(0,5)') +
                                                                      +
 Index index_bridge contents                                          +
 Page 0: level = 0, maxKeyLen = 8, nVacatedBytes = 0                  +
 state = free, datoid equal, relnode equal, ix_type = bridge, dirty   +
     Leftmost, Rightmost                                              +
   Chunk 0: offset = 0, location = 256, hikey location = 64           +
     Item 0: offset = 272, tuple = ('(0,1)', '1')                     +
     Item 1: offset = 304, tuple = ('(0,2)', '2')                     +
     Item 2: offset = 336, tuple = ('(0,3)', '3')                     +
     Item 3: offset = 368, tuple = ('(0,4)', '4')                     +
     Item 4: offset = 400, tuple = ('(0,5)', '5')                     +
                                                                      +
 Index toast: not loaded                                              +
 
(1 row)

CREATE INDEX o_briging_vacuum_test_p_idx on o_briging_vacuum_test using gist(p);
DELETE FROM o_briging_vacuum_test;
VACUUM o_briging_vacuum_test;
SELECT * FROM o_briging_vacuum_test WHERE p <@ box(point(0,0), point(1,1));
 id | val | p 
----+-----+---
(0 rows)

SELECT orioledb_tbl_structure('o_briging_vacuum_test'::regclass, 'ne');
                             orioledb_tbl_structure                             
--------------------------------------------------------------------------------
 Index o_briging_vacuum_test_pkey contents                                     +
 Page 0: level = 0, maxKeyLen = 8, nVacatedBytes = 320                         +
 state = free, datoid equal, relnode equal, ix_type = primary, dirty           +
     Leftmost, Rightmost                                                       +
   Chunk 0: offset = 0, location = 256, hikey location = 64                    +
     Item 0: deleted, offset = 272, tuple = ('1', null, '(0.01,0.02)', '(0,1)')+
     Item 1: deleted, offset = 336, tuple = ('2', null, '(0.02,0.04)', '(0,2)')+
     Item 2: deleted, offset = 400, tuple = ('3', null, '(0.03,0.06)', '(0,3)')+
     Item 3: deleted, offset = 464, tuple = ('4', null, '(0.04,0.08)', '(0,4)')+
     Item 4: deleted, offset = 528, tuple = ('5', null, '(0.05,0.1)', '(0,5)') +
                                                                               +
 Index index_bridge contents                                                   +
 Page 0: level = 0, maxKeyLen = 8, nVacatedBytes = 160                         +
 state = free, datoid equal, relnode equal, ix_type = bridge, dirty            +
     Leftmost, Rightmost                                                       +
   Chunk 0: offset = 0, location = 256, hikey location = 64                    +
                                                                               +
 Index toast: not loaded                                                       +
 
(1 row)

SELECT * FROM gist_page_items(get_raw_page('o_briging_vacuum_test_p_idx', 0), 'o_briging_vacuum_test_p_idx');
 itemoffset | ctid | itemlen | dead | keys 
------------+------+---------+------+------
(0 rows)

DROP TABLE o_briging_vacuum_test;
DROP EXTENSION pageinspect;
DROP EXTENSION orioledb CASCADE;
NOTICE:  drop cascades to table o_test_ix_ams
DROP SCHEMA index_bridging CASCADE;
RESET search_path;
