Parsed test spec with 2 sessions

starting permutation: s2_arm s1_setup s1_begin_rr s1_scan s2_insert s2_checkpoint s2_reset s1_commit
orioledb_evict_pages
--------------------
                    
(1 row)

step s2_arm: 
	SELECT pg_stopevent_set('scan_disk_page', 'true');
pg_stopevent_set
----------------
                
(1 row)

step s1_setup: 
	SET orioledb.enable_stopevents = true;
	SET enable_seqscan = off;
	SET enable_indexscan = off;
	SET enable_indexonlyscan = off;
	SET parallel_setup_cost = 0;
	SET parallel_tuple_cost = 0;
	SET min_parallel_table_scan_size = 0;
	SET min_parallel_index_scan_size = 0;
	SET max_parallel_workers_per_gather = 3;
step s1_begin_rr: BEGIN TRANSACTION ISOLATION LEVEL REPEATABLE READ;
step s1_scan: 
	SELECT count(*), min(id), max(id), sum(id)
		FROM o_bm WHERE val < 50 AND sqrt(id::float8) >= 0; <waiting ...>
step s2_insert: 
	INSERT INTO o_bm SELECT i, i % 1000
		FROM generate_series(1000000, 1030000) i;
step s2_checkpoint: CHECKPOINT;
step s2_reset: 
	SELECT pg_stopevent_reset('scan_disk_page');
pg_stopevent_reset
------------------
t                 
(1 row)

step s1_scan: <... completed>
count|min|  max|     sum
-----+---+-----+--------
 2000|  1|40000|39089000
(1 row)

step s1_commit: COMMIT;

starting permutation: s2_arm s1_setup s1_begin_rr s1_scan s2_delete s2_checkpoint s2_reset s1_commit
orioledb_evict_pages
--------------------
                    
(1 row)

step s2_arm: 
	SELECT pg_stopevent_set('scan_disk_page', 'true');
pg_stopevent_set
----------------
                
(1 row)

step s1_setup: 
	SET orioledb.enable_stopevents = true;
	SET enable_seqscan = off;
	SET enable_indexscan = off;
	SET enable_indexonlyscan = off;
	SET parallel_setup_cost = 0;
	SET parallel_tuple_cost = 0;
	SET min_parallel_table_scan_size = 0;
	SET min_parallel_index_scan_size = 0;
	SET max_parallel_workers_per_gather = 3;
step s1_begin_rr: BEGIN TRANSACTION ISOLATION LEVEL REPEATABLE READ;
step s1_scan: 
	SELECT count(*), min(id), max(id), sum(id)
		FROM o_bm WHERE val < 50 AND sqrt(id::float8) >= 0; <waiting ...>
step s2_delete: 
	DELETE FROM o_bm WHERE id BETWEEN 3000 AND 12000;
step s2_checkpoint: CHECKPOINT;
step s2_reset: 
	SELECT pg_stopevent_reset('scan_disk_page');
pg_stopevent_reset
------------------
t                 
(1 row)

step s1_scan: <... completed>
count|min|  max|     sum
-----+---+-----+--------
 2000|  1|40000|39089000
(1 row)

step s1_commit: COMMIT;

starting permutation: s2_arm s1_setup s1_begin_rr s1_scan s2_update s2_evict s2_reset s1_commit
orioledb_evict_pages
--------------------
                    
(1 row)

step s2_arm: 
	SELECT pg_stopevent_set('scan_disk_page', 'true');
pg_stopevent_set
----------------
                
(1 row)

step s1_setup: 
	SET orioledb.enable_stopevents = true;
	SET enable_seqscan = off;
	SET enable_indexscan = off;
	SET enable_indexonlyscan = off;
	SET parallel_setup_cost = 0;
	SET parallel_tuple_cost = 0;
	SET min_parallel_table_scan_size = 0;
	SET min_parallel_index_scan_size = 0;
	SET max_parallel_workers_per_gather = 3;
step s1_begin_rr: BEGIN TRANSACTION ISOLATION LEVEL REPEATABLE READ;
step s1_scan: 
	SELECT count(*), min(id), max(id), sum(id)
		FROM o_bm WHERE val < 50 AND sqrt(id::float8) >= 0; <waiting ...>
step s2_update: 
	UPDATE o_bm SET val = val + 1 WHERE id BETWEEN 5000 AND 8000;
step s2_evict: 
	SELECT orioledb_evict_pages('o_bm'::regclass::oid, 0);
orioledb_evict_pages
--------------------
                    
(1 row)

step s2_reset: 
	SELECT pg_stopevent_reset('scan_disk_page');
pg_stopevent_reset
------------------
t                 
(1 row)

step s1_scan: <... completed>
count|min|  max|     sum
-----+---+-----+--------
 2000|  1|40000|39089000
(1 row)

step s1_commit: COMMIT;

starting permutation: s2_arm s1_setup s1_begin_rr s1_scan_or s2_insert s2_delete s2_checkpoint s2_reset s1_commit
orioledb_evict_pages
--------------------
                    
(1 row)

step s2_arm: 
	SELECT pg_stopevent_set('scan_disk_page', 'true');
pg_stopevent_set
----------------
                
(1 row)

step s1_setup: 
	SET orioledb.enable_stopevents = true;
	SET enable_seqscan = off;
	SET enable_indexscan = off;
	SET enable_indexonlyscan = off;
	SET parallel_setup_cost = 0;
	SET parallel_tuple_cost = 0;
	SET min_parallel_table_scan_size = 0;
	SET min_parallel_index_scan_size = 0;
	SET max_parallel_workers_per_gather = 3;
step s1_begin_rr: BEGIN TRANSACTION ISOLATION LEVEL REPEATABLE READ;
step s1_scan_or: 
	SELECT count(*), min(id), max(id), sum(id)
		FROM o_bm WHERE (val < 30 OR val > 970) AND sqrt(id::float8) >= 0; <waiting ...>
step s2_insert: 
	INSERT INTO o_bm SELECT i, i % 1000
		FROM generate_series(1000000, 1030000) i;
step s2_delete: 
	DELETE FROM o_bm WHERE id BETWEEN 3000 AND 12000;
step s2_checkpoint: CHECKPOINT;
step s2_reset: 
	SELECT pg_stopevent_reset('scan_disk_page');
pg_stopevent_reset
------------------
t                 
(1 row)

step s1_scan_or: <... completed>
count|min|  max|     sum
-----+---+-----+--------
 2360|  1|40000|47220000
(1 row)

step s1_commit: COMMIT;

starting permutation: s2_arm s1_setup s1_begin_rc s1_scan s2_delete s2_reset s1_commit
orioledb_evict_pages
--------------------
                    
(1 row)

step s2_arm: 
	SELECT pg_stopevent_set('scan_disk_page', 'true');
pg_stopevent_set
----------------
                
(1 row)

step s1_setup: 
	SET orioledb.enable_stopevents = true;
	SET enable_seqscan = off;
	SET enable_indexscan = off;
	SET enable_indexonlyscan = off;
	SET parallel_setup_cost = 0;
	SET parallel_tuple_cost = 0;
	SET min_parallel_table_scan_size = 0;
	SET min_parallel_index_scan_size = 0;
	SET max_parallel_workers_per_gather = 3;
step s1_begin_rc: BEGIN ISOLATION LEVEL READ COMMITTED;
step s1_scan: 
	SELECT count(*), min(id), max(id), sum(id)
		FROM o_bm WHERE val < 50 AND sqrt(id::float8) >= 0; <waiting ...>
step s2_delete: 
	DELETE FROM o_bm WHERE id BETWEEN 3000 AND 12000;
step s2_reset: 
	SELECT pg_stopevent_reset('scan_disk_page');
pg_stopevent_reset
------------------
t                 
(1 row)

step s1_scan: <... completed>
count|min|  max|     sum
-----+---+-----+--------
 2000|  1|40000|39089000
(1 row)

step s1_commit: COMMIT;

starting permutation: s2_arm s1_setup s1_scan s2_update s2_checkpoint s2_reset
orioledb_evict_pages
--------------------
                    
(1 row)

step s2_arm: 
	SELECT pg_stopevent_set('scan_disk_page', 'true');
pg_stopevent_set
----------------
                
(1 row)

step s1_setup: 
	SET orioledb.enable_stopevents = true;
	SET enable_seqscan = off;
	SET enable_indexscan = off;
	SET enable_indexonlyscan = off;
	SET parallel_setup_cost = 0;
	SET parallel_tuple_cost = 0;
	SET min_parallel_table_scan_size = 0;
	SET min_parallel_index_scan_size = 0;
	SET max_parallel_workers_per_gather = 3;
step s1_scan: 
	SELECT count(*), min(id), max(id), sum(id)
		FROM o_bm WHERE val < 50 AND sqrt(id::float8) >= 0; <waiting ...>
step s2_update: 
	UPDATE o_bm SET val = val + 1 WHERE id BETWEEN 5000 AND 8000;
step s2_checkpoint: CHECKPOINT;
step s2_reset: 
	SELECT pg_stopevent_reset('scan_disk_page');
pg_stopevent_reset
------------------
t                 
(1 row)

step s1_scan: <... completed>
count|min|  max|     sum
-----+---+-----+--------
 2000|  1|40000|39089000
(1 row)

