CREATE SCHEMA row_level_locks;
SET SESSION search_path = 'row_level_locks';
CREATE EXTENSION orioledb;
CREATE TABLE rll_test
(
	key int8 not null,
	value int8 not null,
	uniq int8 not null,
	PRIMARY KEY(key),
	UNIQUE(uniq)
) USING orioledb;
INSERT INTO rll_test VALUES (1, 1, 1);
-- Check row-level locks are correctly placed into undo chain
BEGIN;
SELECT * FROM rll_test WHERE key = 1 FOR SHARE;
 key | value | uniq 
-----+-------+------
   1 |     1 |    1
(1 row)

SELECT orioledb_tbl_structure('rll_test'::regclass, 'ne');
                           orioledb_tbl_structure                           
----------------------------------------------------------------------------
 Index rll_test_pkey contents                                              +
 Page 0: level = 0, maxKeyLen = 8, nVacatedBytes = 0                       +
 state = free, datoid equal, relnode equal, ix_type = primary, dirty       +
     Leftmost, Rightmost                                                   +
   Chunk 0: offset = 0, location = 256, hikey location = 64                +
     Item 0: lock only, mode = share, offset = 264, tuple = ('1', '1', '1')+
       Undo item:                                                          +
                                                                           +
 Index rll_test_uniq_key contents                                          +
 Page 0: level = 0, maxKeyLen = 16, nVacatedBytes = 0                      +
 state = free, datoid equal, relnode equal, ix_type = unique, dirty        +
     Leftmost, Rightmost                                                   +
   Chunk 0: offset = 0, location = 256, hikey location = 64                +
     Item 0: offset = 264, tuple = ('1', '1')                              +
                                                                           +
 Index toast: not loaded                                                   +
 
(1 row)

SAVEPOINT s1;
SELECT * FROM rll_test WHERE key = 1 FOR UPDATE;
 key | value | uniq 
-----+-------+------
   1 |     1 |    1
(1 row)

SELECT orioledb_tbl_structure('rll_test'::regclass, 'ne');
                                   orioledb_tbl_structure                                   
--------------------------------------------------------------------------------------------
 Index rll_test_pkey contents                                                              +
 Page 0: level = 0, maxKeyLen = 8, nVacatedBytes = 0                                       +
 state = free, datoid equal, relnode equal, ix_type = primary, dirty                       +
     Leftmost, Rightmost                                                                   +
   Chunk 0: offset = 0, location = 256, hikey location = 64                                +
     Item 0: lock only, mode = update, offset = 264, chainHasLocks, tuple = ('1', '1', '1')+
       Undo item: lock only, mode = share                                                  +
       Undo item:                                                                          +
                                                                                           +
 Index rll_test_uniq_key contents                                                          +
 Page 0: level = 0, maxKeyLen = 16, nVacatedBytes = 0                                      +
 state = free, datoid equal, relnode equal, ix_type = unique, dirty                        +
     Leftmost, Rightmost                                                                   +
   Chunk 0: offset = 0, location = 256, hikey location = 64                                +
     Item 0: offset = 264, tuple = ('1', '1')                                              +
                                                                                           +
 Index toast: not loaded                                                                   +
 
(1 row)

SAVEPOINT s2;
UPDATE rll_test SET value = value + 1 WHERE key = 1;
SELECT orioledb_tbl_structure('rll_test'::regclass, 'ne');
                                orioledb_tbl_structure                                
--------------------------------------------------------------------------------------
 Index rll_test_pkey contents                                                        +
 Page 0: level = 0, maxKeyLen = 8, nVacatedBytes = 0                                 +
 state = free, datoid equal, relnode equal, ix_type = primary, dirty                 +
     Leftmost, Rightmost                                                             +
   Chunk 0: offset = 0, location = 256, hikey location = 64                          +
     Item 0: mode = noKeyUpdate, offset = 264, chainHasLocks, tuple = ('1', '2', '1')+
       Undo item: lock only, mode = update, chainHasLocks, tuple = ('1', '1', '1')   +
       Undo item: lock only, mode = share                                            +
       Undo item:                                                                    +
                                                                                     +
 Index rll_test_uniq_key contents                                                    +
 Page 0: level = 0, maxKeyLen = 16, nVacatedBytes = 0                                +
 state = free, datoid equal, relnode equal, ix_type = unique, dirty                  +
     Leftmost, Rightmost                                                             +
   Chunk 0: offset = 0, location = 256, hikey location = 64                          +
     Item 0: offset = 264, tuple = ('1', '1')                                        +
                                                                                     +
 Index toast: not loaded                                                             +
 
(1 row)

ROLLBACK TO s2;
SELECT orioledb_tbl_structure('rll_test'::regclass, 'ne');
                                   orioledb_tbl_structure                                   
--------------------------------------------------------------------------------------------
 Index rll_test_pkey contents                                                              +
 Page 0: level = 0, maxKeyLen = 8, nVacatedBytes = 0                                       +
 state = free, datoid equal, relnode equal, ix_type = primary, dirty                       +
     Leftmost, Rightmost                                                                   +
   Chunk 0: offset = 0, location = 256, hikey location = 64                                +
     Item 0: lock only, mode = update, offset = 264, chainHasLocks, tuple = ('1', '1', '1')+
       Undo item: lock only, mode = share                                                  +
       Undo item:                                                                          +
                                                                                           +
 Index rll_test_uniq_key contents                                                          +
 Page 0: level = 0, maxKeyLen = 16, nVacatedBytes = 0                                      +
 state = free, datoid equal, relnode equal, ix_type = unique, dirty                        +
     Leftmost, Rightmost                                                                   +
   Chunk 0: offset = 0, location = 256, hikey location = 64                                +
     Item 0: offset = 264, tuple = ('1', '1')                                              +
                                                                                           +
 Index toast: not loaded                                                                   +
 
(1 row)

ROLLBACK TO s1;
SELECT orioledb_tbl_structure('rll_test'::regclass, 'ne');
                           orioledb_tbl_structure                           
----------------------------------------------------------------------------
 Index rll_test_pkey contents                                              +
 Page 0: level = 0, maxKeyLen = 8, nVacatedBytes = 0                       +
 state = free, datoid equal, relnode equal, ix_type = primary, dirty       +
     Leftmost, Rightmost                                                   +
   Chunk 0: offset = 0, location = 256, hikey location = 64                +
     Item 0: lock only, mode = share, offset = 264, tuple = ('1', '1', '1')+
       Undo item:                                                          +
                                                                           +
 Index rll_test_uniq_key contents                                          +
 Page 0: level = 0, maxKeyLen = 16, nVacatedBytes = 0                      +
 state = free, datoid equal, relnode equal, ix_type = unique, dirty        +
     Leftmost, Rightmost                                                   +
   Chunk 0: offset = 0, location = 256, hikey location = 64                +
     Item 0: offset = 264, tuple = ('1', '1')                              +
                                                                           +
 Index toast: not loaded                                                   +
 
(1 row)

ROLLBACK;
SELECT orioledb_tbl_structure('rll_test'::regclass, 'ne');
                       orioledb_tbl_structure                        
---------------------------------------------------------------------
 Index rll_test_pkey contents                                       +
 Page 0: level = 0, maxKeyLen = 8, nVacatedBytes = 0                +
 state = free, datoid equal, relnode equal, ix_type = primary, dirty+
     Leftmost, Rightmost                                            +
   Chunk 0: offset = 0, location = 256, hikey location = 64         +
     Item 0: offset = 264, tuple = ('1', '1', '1')                  +
                                                                    +
 Index rll_test_uniq_key contents                                   +
 Page 0: level = 0, maxKeyLen = 16, nVacatedBytes = 0               +
 state = free, datoid equal, relnode equal, ix_type = unique, dirty +
     Leftmost, Rightmost                                            +
   Chunk 0: offset = 0, location = 256, hikey location = 64         +
     Item 0: offset = 264, tuple = ('1', '1')                       +
                                                                    +
 Index toast: not loaded                                            +
 
(1 row)

BEGIN;
SELECT * FROM rll_test WHERE key = 1 FOR KEY SHARE;
 key | value | uniq 
-----+-------+------
   1 |     1 |    1
(1 row)

SELECT orioledb_tbl_structure('rll_test'::regclass, 'ne');
                            orioledb_tbl_structure                             
-------------------------------------------------------------------------------
 Index rll_test_pkey contents                                                 +
 Page 0: level = 0, maxKeyLen = 8, nVacatedBytes = 0                          +
 state = free, datoid equal, relnode equal, ix_type = primary, dirty          +
     Leftmost, Rightmost                                                      +
   Chunk 0: offset = 0, location = 256, hikey location = 64                   +
     Item 0: lock only, mode = keyShare, offset = 264, tuple = ('1', '1', '1')+
       Undo item:                                                             +
                                                                              +
 Index rll_test_uniq_key contents                                             +
 Page 0: level = 0, maxKeyLen = 16, nVacatedBytes = 0                         +
 state = free, datoid equal, relnode equal, ix_type = unique, dirty           +
     Leftmost, Rightmost                                                      +
   Chunk 0: offset = 0, location = 256, hikey location = 64                   +
     Item 0: offset = 264, tuple = ('1', '1')                                 +
                                                                              +
 Index toast: not loaded                                                      +
 
(1 row)

SELECT * FROM rll_test WHERE key = 1 FOR SHARE;
 key | value | uniq 
-----+-------+------
   1 |     1 |    1
(1 row)

SELECT orioledb_tbl_structure('rll_test'::regclass, 'ne');
                           orioledb_tbl_structure                           
----------------------------------------------------------------------------
 Index rll_test_pkey contents                                              +
 Page 0: level = 0, maxKeyLen = 8, nVacatedBytes = 0                       +
 state = free, datoid equal, relnode equal, ix_type = primary, dirty       +
     Leftmost, Rightmost                                                   +
   Chunk 0: offset = 0, location = 256, hikey location = 64                +
     Item 0: lock only, mode = share, offset = 264, tuple = ('1', '1', '1')+
       Undo item:                                                          +
                                                                           +
 Index rll_test_uniq_key contents                                          +
 Page 0: level = 0, maxKeyLen = 16, nVacatedBytes = 0                      +
 state = free, datoid equal, relnode equal, ix_type = unique, dirty        +
     Leftmost, Rightmost                                                   +
   Chunk 0: offset = 0, location = 256, hikey location = 64                +
     Item 0: offset = 264, tuple = ('1', '1')                              +
                                                                           +
 Index toast: not loaded                                                   +
 
(1 row)

SAVEPOINT s1;
UPDATE rll_test SET value = value + 1 WHERE key = 1;
SELECT orioledb_tbl_structure('rll_test'::regclass, 'ne');
                                orioledb_tbl_structure                                
--------------------------------------------------------------------------------------
 Index rll_test_pkey contents                                                        +
 Page 0: level = 0, maxKeyLen = 8, nVacatedBytes = 0                                 +
 state = free, datoid equal, relnode equal, ix_type = primary, dirty                 +
     Leftmost, Rightmost                                                             +
   Chunk 0: offset = 0, location = 256, hikey location = 64                          +
     Item 0: mode = noKeyUpdate, offset = 264, chainHasLocks, tuple = ('1', '2', '1')+
       Undo item: lock only, mode = share, tuple = ('1', '1', '1')                   +
       Undo item:                                                                    +
                                                                                     +
 Index rll_test_uniq_key contents                                                    +
 Page 0: level = 0, maxKeyLen = 16, nVacatedBytes = 0                                +
 state = free, datoid equal, relnode equal, ix_type = unique, dirty                  +
     Leftmost, Rightmost                                                             +
   Chunk 0: offset = 0, location = 256, hikey location = 64                          +
     Item 0: offset = 264, tuple = ('1', '1')                                        +
                                                                                     +
 Index toast: not loaded                                                             +
 
(1 row)

UPDATE rll_test SET uniq = uniq + 1 WHERE key = 1;
SELECT orioledb_tbl_structure('rll_test'::regclass, 'ne');
                             orioledb_tbl_structure                              
---------------------------------------------------------------------------------
 Index rll_test_pkey contents                                                   +
 Page 0: level = 0, maxKeyLen = 8, nVacatedBytes = 0                            +
 state = free, datoid equal, relnode equal, ix_type = primary, dirty            +
     Leftmost, Rightmost                                                        +
   Chunk 0: offset = 0, location = 256, hikey location = 64                     +
     Item 0: mode = update, offset = 264, chainHasLocks, tuple = ('1', '2', '2')+
       Undo item: mode = noKeyUpdate, chainHasLocks, tuple = ('1', '2', '1')    +
       Undo item: lock only, mode = share, tuple = ('1', '1', '1')              +
       Undo item:                                                               +
                                                                                +
 Index rll_test_uniq_key contents                                               +
 Page 0: level = 0, maxKeyLen = 16, nVacatedBytes = 32                          +
 state = free, datoid equal, relnode equal, ix_type = unique, dirty             +
     Leftmost, Rightmost                                                        +
   Chunk 0: offset = 0, location = 256, hikey location = 64                     +
     Item 0: mode = update, deleted, offset = 264, tuple = ('1', '1')           +
       Undo item:                                                               +
     Item 1: mode = update, offset = 296, tuple = ('2', '1')                    +
                                                                                +
 Index toast: not loaded                                                        +
 
(1 row)

SAVEPOINT s2;
UPDATE rll_test SET uniq = uniq WHERE key = 1;
SELECT orioledb_tbl_structure('rll_test'::regclass, 'ne');
                                orioledb_tbl_structure                                
--------------------------------------------------------------------------------------
 Index rll_test_pkey contents                                                        +
 Page 0: level = 0, maxKeyLen = 8, nVacatedBytes = 0                                 +
 state = free, datoid equal, relnode equal, ix_type = primary, dirty                 +
     Leftmost, Rightmost                                                             +
   Chunk 0: offset = 0, location = 256, hikey location = 64                          +
     Item 0: mode = noKeyUpdate, offset = 264, chainHasLocks, tuple = ('1', '2', '2')+
       Undo item: mode = update, chainHasLocks, tuple = ('1', '2', '2')              +
       Undo item: mode = noKeyUpdate, chainHasLocks, tuple = ('1', '2', '1')         +
       Undo item: lock only, mode = share, tuple = ('1', '1', '1')                   +
       Undo item:                                                                    +
                                                                                     +
 Index rll_test_uniq_key contents                                                    +
 Page 0: level = 0, maxKeyLen = 16, nVacatedBytes = 32                               +
 state = free, datoid equal, relnode equal, ix_type = unique, dirty                  +
     Leftmost, Rightmost                                                             +
   Chunk 0: offset = 0, location = 256, hikey location = 64                          +
     Item 0: mode = update, deleted, offset = 264, tuple = ('1', '1')                +
       Undo item:                                                                    +
     Item 1: mode = update, offset = 296, tuple = ('2', '1')                         +
                                                                                     +
 Index toast: not loaded                                                             +
 
(1 row)

ROLLBACK TO s1;
SELECT orioledb_tbl_structure('rll_test'::regclass, 'ne');
                           orioledb_tbl_structure                           
----------------------------------------------------------------------------
 Index rll_test_pkey contents                                              +
 Page 0: level = 0, maxKeyLen = 8, nVacatedBytes = 8                       +
 state = free, datoid equal, relnode equal, ix_type = primary, dirty       +
     Leftmost, Rightmost                                                   +
   Chunk 0: offset = 0, location = 256, hikey location = 64                +
     Item 0: lock only, mode = share, offset = 264, tuple = ('1', '1', '1')+
       Undo item:                                                          +
                                                                           +
 Index rll_test_uniq_key contents                                          +
 Page 0: level = 0, maxKeyLen = 16, nVacatedBytes = 0                      +
 state = free, datoid equal, relnode equal, ix_type = unique, dirty        +
     Leftmost, Rightmost                                                   +
   Chunk 0: offset = 0, location = 256, hikey location = 64                +
     Item 0: offset = 264, tuple = ('1', '1')                              +
                                                                           +
 Index toast: not loaded                                                   +
 
(1 row)

ROLLBACK;
SELECT orioledb_tbl_structure('rll_test'::regclass, 'ne');
                       orioledb_tbl_structure                        
---------------------------------------------------------------------
 Index rll_test_pkey contents                                       +
 Page 0: level = 0, maxKeyLen = 8, nVacatedBytes = 8                +
 state = free, datoid equal, relnode equal, ix_type = primary, dirty+
     Leftmost, Rightmost                                            +
   Chunk 0: offset = 0, location = 256, hikey location = 64         +
     Item 0: offset = 264, tuple = ('1', '1', '1')                  +
                                                                    +
 Index rll_test_uniq_key contents                                   +
 Page 0: level = 0, maxKeyLen = 16, nVacatedBytes = 0               +
 state = free, datoid equal, relnode equal, ix_type = unique, dirty +
     Leftmost, Rightmost                                            +
   Chunk 0: offset = 0, location = 256, hikey location = 64         +
     Item 0: offset = 264, tuple = ('1', '1')                       +
                                                                    +
 Index toast: not loaded                                            +
 
(1 row)

BEGIN;
SELECT * FROM rll_test WHERE key = 1 FOR SHARE;
 key | value | uniq 
-----+-------+------
   1 |     1 |    1
(1 row)

SELECT orioledb_tbl_structure('rll_test'::regclass, 'ne');
                           orioledb_tbl_structure                           
----------------------------------------------------------------------------
 Index rll_test_pkey contents                                              +
 Page 0: level = 0, maxKeyLen = 8, nVacatedBytes = 8                       +
 state = free, datoid equal, relnode equal, ix_type = primary, dirty       +
     Leftmost, Rightmost                                                   +
   Chunk 0: offset = 0, location = 256, hikey location = 64                +
     Item 0: lock only, mode = share, offset = 264, tuple = ('1', '1', '1')+
       Undo item:                                                          +
                                                                           +
 Index rll_test_uniq_key contents                                          +
 Page 0: level = 0, maxKeyLen = 16, nVacatedBytes = 0                      +
 state = free, datoid equal, relnode equal, ix_type = unique, dirty        +
     Leftmost, Rightmost                                                   +
   Chunk 0: offset = 0, location = 256, hikey location = 64                +
     Item 0: offset = 264, tuple = ('1', '1')                              +
                                                                           +
 Index toast: not loaded                                                   +
 
(1 row)

SELECT * FROM rll_test WHERE key = 1 FOR KEY SHARE;
 key | value | uniq 
-----+-------+------
   1 |     1 |    1
(1 row)

SELECT orioledb_tbl_structure('rll_test'::regclass, 'ne');
                           orioledb_tbl_structure                           
----------------------------------------------------------------------------
 Index rll_test_pkey contents                                              +
 Page 0: level = 0, maxKeyLen = 8, nVacatedBytes = 8                       +
 state = free, datoid equal, relnode equal, ix_type = primary, dirty       +
     Leftmost, Rightmost                                                   +
   Chunk 0: offset = 0, location = 256, hikey location = 64                +
     Item 0: lock only, mode = share, offset = 264, tuple = ('1', '1', '1')+
       Undo item:                                                          +
                                                                           +
 Index rll_test_uniq_key contents                                          +
 Page 0: level = 0, maxKeyLen = 16, nVacatedBytes = 0                      +
 state = free, datoid equal, relnode equal, ix_type = unique, dirty        +
     Leftmost, Rightmost                                                   +
   Chunk 0: offset = 0, location = 256, hikey location = 64                +
     Item 0: offset = 264, tuple = ('1', '1')                              +
                                                                           +
 Index toast: not loaded                                                   +
 
(1 row)

SAVEPOINT s1;
UPDATE rll_test SET uniq = uniq + 1 WHERE key = 1;
SELECT orioledb_tbl_structure('rll_test'::regclass, 'ne');
                             orioledb_tbl_structure                              
---------------------------------------------------------------------------------
 Index rll_test_pkey contents                                                   +
 Page 0: level = 0, maxKeyLen = 8, nVacatedBytes = 8                            +
 state = free, datoid equal, relnode equal, ix_type = primary, dirty            +
     Leftmost, Rightmost                                                        +
   Chunk 0: offset = 0, location = 256, hikey location = 64                     +
     Item 0: mode = update, offset = 264, chainHasLocks, tuple = ('1', '1', '2')+
       Undo item: lock only, mode = share, tuple = ('1', '1', '1')              +
       Undo item:                                                               +
                                                                                +
 Index rll_test_uniq_key contents                                               +
 Page 0: level = 0, maxKeyLen = 16, nVacatedBytes = 32                          +
 state = free, datoid equal, relnode equal, ix_type = unique, dirty             +
     Leftmost, Rightmost                                                        +
   Chunk 0: offset = 0, location = 256, hikey location = 64                     +
     Item 0: mode = update, deleted, offset = 264, tuple = ('1', '1')           +
       Undo item:                                                               +
     Item 1: mode = update, offset = 296, tuple = ('2', '1')                    +
                                                                                +
 Index toast: not loaded                                                        +
 
(1 row)

UPDATE rll_test SET value = value + 1 WHERE key = 1;
SELECT orioledb_tbl_structure('rll_test'::regclass, 'ne');
                                orioledb_tbl_structure                                
--------------------------------------------------------------------------------------
 Index rll_test_pkey contents                                                        +
 Page 0: level = 0, maxKeyLen = 8, nVacatedBytes = 0                                 +
 state = free, datoid equal, relnode equal, ix_type = primary, dirty                 +
     Leftmost, Rightmost                                                             +
   Chunk 0: offset = 0, location = 256, hikey location = 64                          +
     Item 0: mode = noKeyUpdate, offset = 264, chainHasLocks, tuple = ('1', '2', '2')+
       Undo item: mode = update, chainHasLocks, tuple = ('1', '1', '2')              +
       Undo item: lock only, mode = share, tuple = ('1', '1', '1')                   +
       Undo item:                                                                    +
                                                                                     +
 Index rll_test_uniq_key contents                                                    +
 Page 0: level = 0, maxKeyLen = 16, nVacatedBytes = 32                               +
 state = free, datoid equal, relnode equal, ix_type = unique, dirty                  +
     Leftmost, Rightmost                                                             +
   Chunk 0: offset = 0, location = 256, hikey location = 64                          +
     Item 0: mode = update, deleted, offset = 264, tuple = ('1', '1')                +
       Undo item:                                                                    +
     Item 1: mode = update, offset = 296, tuple = ('2', '1')                         +
                                                                                     +
 Index toast: not loaded                                                             +
 
(1 row)

ROLLBACK TO s1;
SELECT orioledb_tbl_structure('rll_test'::regclass, 'ne');
                           orioledb_tbl_structure                           
----------------------------------------------------------------------------
 Index rll_test_pkey contents                                              +
 Page 0: level = 0, maxKeyLen = 8, nVacatedBytes = 8                       +
 state = free, datoid equal, relnode equal, ix_type = primary, dirty       +
     Leftmost, Rightmost                                                   +
   Chunk 0: offset = 0, location = 256, hikey location = 64                +
     Item 0: lock only, mode = share, offset = 264, tuple = ('1', '1', '1')+
       Undo item:                                                          +
                                                                           +
 Index rll_test_uniq_key contents                                          +
 Page 0: level = 0, maxKeyLen = 16, nVacatedBytes = 0                      +
 state = free, datoid equal, relnode equal, ix_type = unique, dirty        +
     Leftmost, Rightmost                                                   +
   Chunk 0: offset = 0, location = 256, hikey location = 64                +
     Item 0: offset = 264, tuple = ('1', '1')                              +
                                                                           +
 Index toast: not loaded                                                   +
 
(1 row)

ROLLBACK;
SELECT orioledb_tbl_structure('rll_test'::regclass, 'ne');
                       orioledb_tbl_structure                        
---------------------------------------------------------------------
 Index rll_test_pkey contents                                       +
 Page 0: level = 0, maxKeyLen = 8, nVacatedBytes = 8                +
 state = free, datoid equal, relnode equal, ix_type = primary, dirty+
     Leftmost, Rightmost                                            +
   Chunk 0: offset = 0, location = 256, hikey location = 64         +
     Item 0: offset = 264, tuple = ('1', '1', '1')                  +
                                                                    +
 Index rll_test_uniq_key contents                                   +
 Page 0: level = 0, maxKeyLen = 16, nVacatedBytes = 0               +
 state = free, datoid equal, relnode equal, ix_type = unique, dirty +
     Leftmost, Rightmost                                            +
   Chunk 0: offset = 0, location = 256, hikey location = 64         +
     Item 0: offset = 264, tuple = ('1', '1')                       +
                                                                    +
 Index toast: not loaded                                            +
 
(1 row)

DROP TABLE rll_test;
CREATE TABLE trigger_test
(
	id int4 not null primary key,
	value text not null
) USING orioledb;
CREATE OR REPLACE FUNCTION update_trg_func() RETURNS trigger AS
$$BEGIN
	RAISE NOTICE 'old: (%, %), new: (%, %)', OLD.id, OLD.value, NEW.id, NEW.value;
	RETURN NEW;
END;$$ LANGUAGE plpgsql;
CREATE OR REPLACE FUNCTION delete_trg_func() RETURNS trigger AS
$$BEGIN
	RAISE NOTICE 'old: (%, %)', OLD.id, OLD.value;
	RETURN OLD;
END;$$ LANGUAGE plpgsql;
CREATE TRIGGER before_update_trg
	BEFORE UPDATE ON trigger_test FOR EACH ROW
	EXECUTE PROCEDURE update_trg_func();
CREATE TRIGGER after_update_trg
	AFTER UPDATE ON trigger_test FOR EACH ROW
	EXECUTE PROCEDURE update_trg_func();
CREATE TRIGGER before_delete_trg
	BEFORE DELETE ON trigger_test FOR EACH ROW
	EXECUTE PROCEDURE delete_trg_func();
CREATE TRIGGER after_delete_trg
	AFTER DELETE ON trigger_test FOR EACH ROW
	EXECUTE PROCEDURE delete_trg_func();
INSERT INTO trigger_test VALUES (1, 'abc');
UPDATE trigger_test SET value = 'def' WHERE id = 1;
NOTICE:  old: (1, abc), new: (1, def)
NOTICE:  old: (1, abc), new: (1, def)
DELETE FROM trigger_test WHERE id = 1;
NOTICE:  old: (1, def)
NOTICE:  old: (1, def)
DROP TABLE trigger_test;
CREATE TABLE trigger_test
(
	id int4 not null,
	value text not null
) USING orioledb;
CREATE TRIGGER before_update_trg
	BEFORE UPDATE ON trigger_test FOR EACH ROW
	EXECUTE PROCEDURE update_trg_func();
CREATE TRIGGER after_update_trg
	AFTER UPDATE ON trigger_test FOR EACH ROW
	EXECUTE PROCEDURE update_trg_func();
CREATE TRIGGER before_delete_trg
	BEFORE DELETE ON trigger_test FOR EACH ROW
	EXECUTE PROCEDURE delete_trg_func();
CREATE TRIGGER after_delete_trg
	AFTER DELETE ON trigger_test FOR EACH ROW
	EXECUTE PROCEDURE delete_trg_func();
INSERT INTO trigger_test VALUES (1, 'abc');
UPDATE trigger_test SET value = 'def' WHERE id = 1;
NOTICE:  old: (1, abc), new: (1, def)
NOTICE:  old: (1, abc), new: (1, def)
DELETE FROM trigger_test WHERE id = 1;
NOTICE:  old: (1, def)
NOTICE:  old: (1, def)
BEGIN;
INSERT INTO trigger_test VALUES (2, 'a');
UPDATE trigger_test SET value = 'b' WHERE id = 2;
NOTICE:  old: (2, a), new: (2, b)
NOTICE:  old: (2, a), new: (2, b)
DELETE FROM trigger_test WHERE id = 2;
NOTICE:  old: (2, b)
NOTICE:  old: (2, b)
COMMIT;
CREATE TABLE rll_test2
(
	key int8 not null,
	value int8 not null,
	spacer text,
	PRIMARY KEY(key)
) USING orioledb;
INSERT INTO rll_test2 (SELECT i, i FROM generate_series(1, 100) i);
-- Add record with prevHasLocks flag
SELECT * FROM rll_test2 WHERE key = 1 FOR KEY SHARE;
 key | value | spacer 
-----+-------+--------
   1 |     1 | 
(1 row)

UPDATE rll_test2 SET value = value + 1 WHERE key = 1;
-- Issue some amount of undo to update the retained location
UPDATE rll_test2 SET spacer = repeat('a', 1000) WHERE key > 1;
UPDATE rll_test2 SET spacer = repeat('b', 1000) WHERE key > 1;
UPDATE rll_test2 SET spacer = repeat('c', 1000) WHERE key > 1;
-- Check how we cleanup prevHasLocks
SELECT * FROM rll_test2 WHERE key = 1 FOR UPDATE;
 key | value | spacer 
-----+-------+--------
   1 |     2 | 
(1 row)

CREATE TABLE o_test_update_locked_for_update (
	key int NOT NULL PRIMARY KEY,
	val_1 text,
	val_2 int
) USING orioledb;
INSERT INTO o_test_update_locked_for_update VALUES (1, 'a', 0);
SELECT orioledb_tbl_structure('o_test_update_locked_for_update'::regclass,
							  'fen');
                        orioledb_tbl_structure                         
-----------------------------------------------------------------------
 Index o_test_update_locked_for_update_pkey contents                  +
 Page 0: level = 0, maxKeyLen = 8, nVacatedBytes = 0                  +
 state = free, datoid equal, relnode equal, ix_type = primary, dirty  +
     Leftmost, Rightmost                                              +
   Chunk 0: offset = 0, location = 256, hikey location = 64           +
     Item 0: format = NOT FIXED, offset = 264, tuple = ('1', 'a', '0')+
                                                                      +
 Index toast: not loaded                                              +
 
(1 row)

SELECT * FROM o_test_update_locked_for_update;
 key | val_1 | val_2 
-----+-------+-------
   1 | a     |     0
(1 row)

BEGIN;
UPDATE o_test_update_locked_for_update SET val_2 = val_2 - 1 WHERE key = 1;
SELECT orioledb_tbl_structure('o_test_update_locked_for_update'::regclass,
							  'fen');
                                   orioledb_tbl_structure                                   
--------------------------------------------------------------------------------------------
 Index o_test_update_locked_for_update_pkey contents                                       +
 Page 0: level = 0, maxKeyLen = 8, nVacatedBytes = 0                                       +
 state = free, datoid equal, relnode equal, ix_type = primary, dirty                       +
     Leftmost, Rightmost                                                                   +
   Chunk 0: offset = 0, location = 256, hikey location = 64                                +
     Item 0: mode = noKeyUpdate, format = NOT FIXED, offset = 264, tuple = ('1', 'a', '-1')+
       Undo item: format = NOT FIXED, tuple = ('1', 'a', '0')                              +
                                                                                           +
 Index toast: not loaded                                                                   +
 
(1 row)

SELECT * FROM o_test_update_locked_for_update;
 key | val_1 | val_2 
-----+-------+-------
   1 | a     |    -1
(1 row)

SELECT * FROM o_test_update_locked_for_update FOR UPDATE;
 key | val_1 | val_2 
-----+-------+-------
   1 | a     |    -1
(1 row)

SELECT orioledb_tbl_structure('o_test_update_locked_for_update'::regclass,
							  'fen');
                                      orioledb_tbl_structure                                      
--------------------------------------------------------------------------------------------------
 Index o_test_update_locked_for_update_pkey contents                                             +
 Page 0: level = 0, maxKeyLen = 8, nVacatedBytes = 0                                             +
 state = free, datoid equal, relnode equal, ix_type = primary, dirty                             +
     Leftmost, Rightmost                                                                         +
   Chunk 0: offset = 0, location = 256, hikey location = 64                                      +
     Item 0: lock only, mode = update, format = NOT FIXED, offset = 264, tuple = ('1', 'a', '-1')+
       Undo item: mode = noKeyUpdate, format = FIXED                                             +
       Undo item: format = NOT FIXED, tuple = ('1', 'a', '0')                                    +
                                                                                                 +
 Index toast: not loaded                                                                         +
 
(1 row)

SELECT * FROM o_test_update_locked_for_update;
 key | val_1 | val_2 
-----+-------+-------
   1 | a     |    -1
(1 row)

UPDATE o_test_update_locked_for_update SET val_2 = val_2 - 1 WHERE key = 1;
SELECT orioledb_tbl_structure('o_test_update_locked_for_update'::regclass,
							  'fen');
                                          orioledb_tbl_structure                                           
-----------------------------------------------------------------------------------------------------------
 Index o_test_update_locked_for_update_pkey contents                                                      +
 Page 0: level = 0, maxKeyLen = 8, nVacatedBytes = 0                                                      +
 state = free, datoid equal, relnode equal, ix_type = primary, dirty                                      +
     Leftmost, Rightmost                                                                                  +
   Chunk 0: offset = 0, location = 256, hikey location = 64                                               +
     Item 0: mode = noKeyUpdate, format = NOT FIXED, offset = 264, chainHasLocks, tuple = ('1', 'a', '-2')+
       Undo item: lock only, mode = update, format = NOT FIXED, tuple = ('1', 'a', '-1')                  +
       Undo item: mode = noKeyUpdate, format = FIXED                                                      +
       Undo item: format = NOT FIXED, tuple = ('1', 'a', '0')                                             +
                                                                                                          +
 Index toast: not loaded                                                                                  +
 
(1 row)

SELECT * FROM o_test_update_locked_for_update;
 key | val_1 | val_2 
-----+-------+-------
   1 | a     |    -2
(1 row)

DELETE FROM o_test_update_locked_for_update WHERE KEY = 1;
SELECT orioledb_tbl_structure('o_test_update_locked_for_update'::regclass,
							  'fen');
                                     orioledb_tbl_structure                                     
------------------------------------------------------------------------------------------------
 Index o_test_update_locked_for_update_pkey contents                                           +
 Page 0: level = 0, maxKeyLen = 8, nVacatedBytes = 40                                          +
 state = free, datoid equal, relnode equal, ix_type = primary, dirty                           +
     Leftmost, Rightmost                                                                       +
   Chunk 0: offset = 0, location = 256, hikey location = 64                                    +
     Item 0: mode = update, format = NOT FIXED, deleted, offset = 264, tuple = ('1', 'a', '-2')+
       Undo item: mode = noKeyUpdate, format = NOT FIXED                                       +
       Undo item: mode = noKeyUpdate, format = NOT FIXED, tuple = ('1', 'a', '-1')             +
       Undo item: format = NOT FIXED, tuple = ('1', 'a', '0')                                  +
                                                                                               +
 Index toast: not loaded                                                                       +
 
(1 row)

SELECT * FROM o_test_update_locked_for_update;
 key | val_1 | val_2 
-----+-------+-------
(0 rows)

ROLLBACK;
SELECT orioledb_tbl_structure('o_test_update_locked_for_update'::regclass,
							  'fen');
                        orioledb_tbl_structure                         
-----------------------------------------------------------------------
 Index o_test_update_locked_for_update_pkey contents                  +
 Page 0: level = 0, maxKeyLen = 8, nVacatedBytes = 0                  +
 state = free, datoid equal, relnode equal, ix_type = primary, dirty  +
     Leftmost, Rightmost                                              +
   Chunk 0: offset = 0, location = 256, hikey location = 64           +
     Item 0: format = NOT FIXED, offset = 264, tuple = ('1', 'a', '0')+
                                                                      +
 Index toast: not loaded                                              +
 
(1 row)

SELECT * FROM o_test_update_locked_for_update;
 key | val_1 | val_2 
-----+-------+-------
   1 | a     |     0
(1 row)

UPDATE o_test_update_locked_for_update SET val_2 = val_2 - 1 WHERE key = 1;
SELECT orioledb_tbl_structure('o_test_update_locked_for_update'::regclass,
							  'fen');
                         orioledb_tbl_structure                         
------------------------------------------------------------------------
 Index o_test_update_locked_for_update_pkey contents                   +
 Page 0: level = 0, maxKeyLen = 8, nVacatedBytes = 0                   +
 state = free, datoid equal, relnode equal, ix_type = primary, dirty   +
     Leftmost, Rightmost                                               +
   Chunk 0: offset = 0, location = 256, hikey location = 64            +
     Item 0: format = NOT FIXED, offset = 264, tuple = ('1', 'a', '-1')+
                                                                       +
 Index toast: not loaded                                               +
 
(1 row)

SELECT * FROM o_test_update_locked_for_update;
 key | val_1 | val_2 
-----+-------+-------
   1 | a     |    -1
(1 row)

DROP EXTENSION orioledb CASCADE;
NOTICE:  drop cascades to 3 other objects
DETAIL:  drop cascades to table trigger_test
drop cascades to table rll_test2
drop cascades to table o_test_update_locked_for_update
DROP SCHEMA row_level_locks CASCADE;
NOTICE:  drop cascades to 2 other objects
DETAIL:  drop cascades to function update_trg_func()
drop cascades to function delete_trg_func()
RESET search_path;
